url,title,description,published_date
https://samakal.com/whole-country/article/303826/%E0%A6%AD%E0%A7%82%E0%A6%AE%E0%A6%BF-%E0%A6%85%E0%A6%A7%E0%A6%BF%E0%A6%97%E0%A7%8D%E0%A6%B0%E0%A6%B9%E0%A6%A3-%E0%A6%A8%E0%A6%BE-%E0%A6%95%E0%A6%B0%E0%A7%87%E0%A6%87-%E0%A6%95%E0%A6%BE%E0%A6%9C,ভূমি অধিগ্রহণ না করেই কাজ,সাঁথিয়া উপজেলার গাগড়াখালী-সোনাতলা বাইপাস সড়ক উন্নয়নকাজ শুরু হয়েছিল ছয় বছর আগে। ঠিকাদারি প্রতিষ্ঠান আগের অপ্রশস্ত সড়কের পাশে মাটি ফেলাসহ কয়েকটি কালভার্ট নির্মাণের কাজ শুরু,2025-07-04
https://samakal.com/whole-country/article/303821/%E0%A6%AC%E0%A6%BF%E0%A6%8F%E0%A6%A8%E0%A6%AA%E0%A6%BF%E0%A6%B0-%E0%A7%A7%E0%A7%AC-%E0%A6%A8%E0%A7%87%E0%A6%A4%E0%A6%BE%E0%A6%95%E0%A6%B0%E0%A7%8D%E0%A6%AE%E0%A7%80%E0%A6%B0-%E0%A6%AC%E0%A6%BF%E0%A6%B0%E0%A7%81%E0%A6%A6%E0%A7%8D%E0%A6%A7%E0%A7%87-%E0%A6%A5%E0%A6%BE%E0%A6%A8%E0%A6%BE%E0%A7%9F-%E0%A6%85%E0%A6%AD%E0%A6%BF%E0%A6%AF%E0%A7%8B%E0%A6%97,এ. কে. আজাদের বাড়িতে চড়াও / বিএনপির ১৬ নেতাকর্মীর বিরুদ্ধে থানায় অভিযোগ,ফরিদপুরে হা-মীম গ্রুপের ব্যবস্থাপনা পরিচালক এ. কে. আজাদের বাড়িতে স্থানীয় বিএনপির একাংশের নেতাকর্মীর চড়াও হওয়ার ঘটনায় থানায় অভিযোগ দেওয়া হয়েছে। শুক্রবার সন্ধ্যায় হা-মীম গ্রুপের ল্যান্ড কর্মকর্তা মোহাম্মদ রাফিজুল খান ফরিদপুর কোতোয়ালি থানায় এজাহার জমা দেন।,2025-07-04
https://samakal.com/whole-country/article/303820/%E0%A6%A4%E0%A7%87%E0%A6%B2%E0%A6%AC%E0%A6%BE%E0%A6%B9%E0%A7%80-%E0%A6%9F%E0%A7%8D%E0%A6%B0%E0%A6%BE%E0%A6%95%E0%A6%9A%E0%A6%BE%E0%A6%AA%E0%A6%BE%E0%A7%9F-%E0%A6%87%E0%A6%9C%E0%A6%BF%E0%A6%AC%E0%A6%BE%E0%A6%87%E0%A6%95%E0%A7%87%E0%A6%B0-%E0%A6%9A%E0%A6%BE%E0%A6%B2%E0%A6%95%E0%A6%B8%E0%A6%B9-%E0%A6%A8%E0%A6%BF%E0%A6%B9%E0%A6%A4-%E0%A7%A9,তেলবাহী ট্রাকচাপায় ইজিবাইকের চালকসহ নিহত ৩,চুয়াডাঙ্গা সদরের জাফরপুরে তেলবাহী ট্রাকচাপায় ব্যাটারিচালিত ইজিবাইকের চালকসহ তিনজন নিহত হয়েছেন। আজ শুক্রবার সন্ধ্যার কিছুক্ষণ আগে চুয়াডাঙ্গা সদরের জাফরপুরে বিজিবি-৬ ব্যাটালিয়ন ক্যাম্পের কাছাকাছি এ দুর্ঘটনায় শিশুসহ আরও চারজন ইজিবাইকের যাত্রী আহত হয়েছেন।,2025-07-04
https://samakal.com/whole-country/article/303818/%E0%A6%9A%E0%A6%AC%E0%A6%BF%E0%A6%A4%E0%A7%87-%E0%A6%B6%E0%A6%BF%E0%A6%95%E0%A7%8D%E0%A6%B7%E0%A6%95%E0%A6%95%E0%A7%87-%E0%A6%98%E0%A6%BF%E0%A6%B0%E0%A7%87-%E0%A6%AC%E0%A6%BF%E0%A6%95%E0%A7%8D%E0%A6%B7%E0%A7%8B%E0%A6%AD-%E2%80%98%E0%A6%AE%E0%A6%AC%E2%80%99-%E0%A6%B8%E0%A7%83%E0%A6%B7%E0%A7%8D%E0%A6%9F%E0%A6%BF%E0%A6%B0-%E0%A6%85%E0%A6%AD%E0%A6%BF%E0%A6%AF%E0%A7%8B%E0%A6%97,"চবিতে শিক্ষককে ঘিরে বিক্ষোভ, ‘মব’ সৃষ্টির অভিযোগ",পদোন্নতির সাক্ষাৎকার দিতে যাওয়া শিক্ষককে বরখাস্তের দাবিতে বিক্ষোভ হয়েছে চট্টগ্রাম বিশ্ববিদ্যালয়ে। শুক্রবার বিকেল ৫টার দিকে বিশ্ববিদ্যালয়ের উপাচার্য কার্যালয়ের ভেতরে এ ঘটনা ঘটে। এ সময় বেশ হট্টগোলের পাশাপাশি তাঁকে হেনস্তার ঘটনাও ঘটে। পদোন্নতির সাক্ষাৎকার দিতে যাওয়া শিক্ষকের নাম কুশল বরণ চক্রবর্তী। শিক্ষার্থীদের দাবির মুখে পদোন্নতি বোর্ডের কার্যক্রম স্থগিত করার কথা জানিয়েছে চট্টগ্রাম বিশ্ববিদ্যালয় প্রশাসন।,2025-07-04
https://samakal.com/whole-country/article/303816/%E0%A6%AE%E0%A6%B8%E0%A6%9C%E0%A6%BF%E0%A6%A6%E0%A7%87%E0%A6%B0-%E0%A6%AE%E0%A7%8B%E0%A6%A4%E0%A6%BE%E0%A6%93%E0%A7%9F%E0%A6%BE%E0%A6%B2%E0%A7%8D%E0%A6%B2%E0%A6%BF-%E0%A6%A8%E0%A6%BF%E0%A7%9F%E0%A7%87%E0%A6%BE%E0%A6%97-%E0%A6%A8%E0%A6%BF%E0%A7%9F%E0%A7%87-%E0%A6%B8%E0%A6%82%E0%A6%98%E0%A6%B0%E0%A7%8D%E0%A6%B7%E0%A7%87-%E0%A6%86%E0%A6%B9%E0%A6%A4-%E0%A7%AB%E0%A7%A6,মসজিদের মোতাওয়াল্লি নিয়োগ নিয়ে সংঘর্ষে আহত ৫০,হবিগঞ্জের নবীগঞ্জ উপজেলায় মসজিদের মোতাওয়াল্লি নিয়োগ ও আয়-ব্যয়ের হিসাব নিয়ে দুই পক্ষের বিরোধের জেরে সংঘর্ষে অন্তত ৫০ জন আহত হয়েছেন। শুক্রবার উপজেলার দীঘলবাক ইউনিয়নের মথুরাপুর জামে মসজিদে এ ঘটনা ঘটে। গুরুতর আহত কয়েকজনকে সিলেট ওসমানী মেডিকেল কলেজ হাসপাতালে ভর্তি করা হয়েছে।,2025-07-04
https://samakal.com/whole-country/article/303815/%E0%A6%AE%E0%A6%BE%E0%A6%A6%E0%A7%8D%E0%A6%B0%E0%A6%BE%E0%A6%B8%E0%A6%BE-%E0%A6%A4%E0%A6%BE%E0%A6%B2%E0%A6%BE%E0%A6%AC%E0%A6%A6%E0%A7%8D%E0%A6%A7-%E0%A6%95%E0%A6%B0%E0%A7%87-%E0%A6%9C%E0%A6%BE%E0%A6%AE%E0%A6%BE%E0%A7%9F%E0%A6%BE%E0%A6%A4-%E0%A6%AA%E0%A7%8D%E0%A6%B0%E0%A6%BE%E0%A6%B0%E0%A7%8D%E0%A6%A5%E0%A7%80%E0%A6%B0-%E0%A6%AA%E0%A6%A5%E0%A6%B8%E0%A6%AD%E0%A6%BE%E0%A7%9F-%E0%A6%B6%E0%A6%BF%E0%A6%95%E0%A7%8D%E0%A6%B7%E0%A6%95-%E0%A6%B6%E0%A6%BF%E0%A6%95%E0%A7%8D%E0%A6%B7%E0%A6%BE%E0%A6%B0%E0%A7%8D%E0%A6%A5%E0%A7%80%E0%A6%B0%E0%A6%BE,মাদ্রাসা তালাবদ্ধ করে জামায়াত প্রার্থীর পথসভায় শিক্ষক-শিক্ষার্থীরা,সুনামগঞ্জের তাহিরপুরে অর্ধবার্ষিক পরীক্ষা চলাকালে মাদ্রাসা তালাবদ্ধ রেখে শিক্ষক-শিক্ষার্থীদের জামায়াতে ইসলামী মনোনীত প্রার্থীর পথসভায় অংশ নেওয়ার অভিযোগ উঠেছে। বৃহস্পতিবার উপজেলার শ্রীপুর উত্তর ইউনিয়নে সীমান্তবর্তী কলাগাঁও জামেয়া ইসলামিয়া দাখিল মাদ্রাসায় এমন ঘটনা ঘটেছে। ঘটনার ভিডিও ফুটেজ ছড়িয়ে পড়লে সামাজিক যোগাযোগমাধ্যম ও স্থানীয়ভাবে সমালোচনার সৃষ্টি হয়েছে।,2025-07-04
https://samakal.com/whole-country/article/303814/%E0%A6%9C%E0%A7%81%E0%A6%B2%E0%A6%BE%E0%A6%87-%E0%A6%AC%E0%A6%BF%E0%A6%AA%E0%A7%8D%E0%A6%B2%E0%A6%AC%E0%A7%87%E0%A6%B0-%E0%A6%B8%E0%A7%8D%E0%A6%AE%E0%A7%83%E0%A6%A4%E0%A6%BF-%E0%A6%A7%E0%A6%B0%E0%A7%87-%E0%A6%B0%E0%A6%BE%E0%A6%96%E0%A6%A4%E0%A7%87-%E0%A6%B8%E0%A6%BF%E0%A6%95%E0%A7%83%E0%A6%AC%E0%A6%BF%E0%A6%A4%E0%A7%87-%E2%80%98%E0%A6%9C%E0%A7%81%E0%A6%B2%E0%A6%BE%E0%A6%87-%E0%A7%A9%E0%A7%AC-%E0%A6%97%E0%A7%87%E0%A6%87%E0%A6%9F%E2%80%99,জুলাই বিপ্লবের স্মৃতি ধরে রাখতে সিকৃবিতে ‘জুলাই ৩৬ গেইট’,সিলেট কৃষি বিশ্ববিদ্যালয়ের (সিকৃবি) প্রধান গেটটি (ফটক) ছিল ছোট আকারের। সেখানে একটি নান্দনিক গেট নির্মাণে দীর্ঘদিন ধরে দাবি জানিয়ে আসছিলেন শিক্ষার্থীরা। এর পরিপ্রেক্ষিতে সেখানে ১ কোটি ৩৬ লাখ টাকা ব্যয়ে নান্দনিক ফটক নির্মাণ করা হয়েছে।,2025-07-04
https://samakal.com/whole-country/article/303812/%E0%A6%B8%E0%A6%82%E0%A6%AC%E0%A6%BF%E0%A6%A7%E0%A6%BE%E0%A6%A8%E0%A7%87-%E0%A6%9C%E0%A7%81%E0%A6%B2%E0%A6%BE%E0%A6%87-%E0%A6%98%E0%A7%8B%E0%A6%B7%E0%A6%A3%E0%A6%BE%E0%A6%AA%E0%A6%A4%E0%A7%8D%E0%A6%B0-%E0%A6%AF%E0%A7%81%E0%A6%95%E0%A7%8D%E0%A6%A4-%E0%A6%95%E0%A6%B0%E0%A6%A4%E0%A7%87%E0%A6%87-%E0%A6%B9%E0%A6%AC%E0%A7%87:-%E0%A6%A8%E0%A6%BE%E0%A6%B9%E0%A6%BF%E0%A6%A6-%E0%A6%87%E0%A6%B8%E0%A6%B2%E0%A6%BE%E0%A6%AE,সংবিধানে জুলাই ঘোষণাপত্র যুক্ত করতেই হবে: নাহিদ ইসলাম,"জুলাই ঘোষণাপত্র সংবিধানে যুক্ত করতেই হবে বলে জানিয়েছেন জাতীয় নাগরিক পার্টির (এনসিপি) আহ্বায়ক নাহিদ ইসলাম। তিনি বলেন, জুলাই ঘোষণাপত্রের নাকি কোনো সাংবিধানিক ভিত্তি থাকবে না। আমরা স্পষ্ট বলছি, এই ঘোষণাপত্রে জুলাইযোদ্ধা, গণঅভ্যুত্থানের শহীদদের মর্যাদা, স্বীকৃতি ও রাজনৈতিক নিরাপত্তার কথা থাকতে হবে। সেটি অবশ্যই বাংলাদেশের নতুন সংবিধানে যুক্ত হবে।",2025-07-04
https://samakal.com/whole-country/article/303811/%E0%A6%B8%E0%A6%BE%E0%A6%AC%E0%A7%87%E0%A6%95-%E0%A6%95%E0%A6%BE%E0%A6%89%E0%A6%A8%E0%A7%8D%E0%A6%B8%E0%A6%BF%E0%A6%B2%E0%A6%B0-%E0%A6%AC%E0%A6%95%E0%A7%81%E0%A6%B2%E0%A6%95%E0%A7%87-%E0%A6%B0%E0%A7%87%E0%A6%96%E0%A7%87-%E0%A6%8F%E0%A6%9C%E0%A6%BE%E0%A6%B9%E0%A6%BE%E0%A6%B0%E0%A6%AD%E0%A7%81%E0%A6%95%E0%A7%8D%E0%A6%A4-%E0%A7%A9-%E0%A6%86%E0%A6%B8%E0%A6%BE%E0%A6%AE%E0%A6%BF-%E0%A6%AC%E0%A6%BE%E0%A6%A6,রোহিঙ্গা নারীকে পাসপোর্ট পেতে সহযোগিতার মামলা / সাবেক কাউন্সিলর বকুলকে রেখে এজাহারভুক্ত ৩ আসামি বাদ,"কক্সবাজারে রোহিঙ্গা নারীকে পাসপোর্ট পেতে সহযোগিতার মামলায় নিজেদের এজাহারভুক্ত তিন আসামিকে বাদ দিয়ে শুধু একজনের বিরুদ্ধে আদালতে অভিযোগপত্র জমা দিয়েছে দুদক। অভিযোগপত্র অনুযায়ী, এই মামলার বর্তমানে একমাত্র আসামি কক্সবাজার পৌরসভার সাবেক কাউন্সিলর ও জেলা মহিলা দলের সাবেক সভাপতি নেত্রী নাছিমা আক্তার বকুল।",2025-07-04
https://samakal.com/whole-country/article/303810/%E0%A6%A8%E0%A6%BF%E0%A6%96%E0%A7%8B%E0%A6%81%E0%A6%9C%E0%A7%87%E0%A6%B0-%E0%A6%A6%E0%A7%81%E0%A6%87-%E0%A6%A6%E0%A6%BF%E0%A6%A8-%E0%A6%AA%E0%A6%B0-%E0%A6%A1%E0%A7%8B%E0%A6%AC%E0%A6%BE%E0%A7%9F-%E0%A6%AE%E0%A6%BF%E0%A6%B2%E0%A6%B2-%E0%A6%AE%E0%A6%BE%E0%A6%A8%E0%A6%B8%E0%A6%BF%E0%A6%95-%E0%A6%AA%E0%A7%8D%E0%A6%B0%E0%A6%A4%E0%A6%BF%E0%A6%AC%E0%A6%A8%E0%A7%8D%E0%A6%A7%E0%A7%80%E0%A6%B0-%E0%A6%B2%E0%A6%BE%E0%A6%B6,নিখোঁজের দুই দিন পর ডোবায় মিলল মানসিক প্রতিবন্ধীর লাশ,সিরাজগঞ্জের কামারখন্দ উপজেলায় নিখোঁজের দুই দিন পর শামীম শেখ (২৮) নামের মানসিক প্রতিবন্ধী এক যুবকের লাশ উদ্ধার করেছে পুলিশ। শুক্রবার উপজেলার ভদ্রঘাট ইউনিয়নের কুঠিরচর গ্রামের এসিআই ফুড লিমিটেডের কারখানার পাশের ডোবা থেকে লাশ উদ্ধার করা হয়।,2025-07-04
https://samakal.com/whole-country/article/303828/%E0%A6%B8%E0%A7%80%E0%A6%A4%E0%A6%BE%E0%A6%95%E0%A7%81%E0%A6%A3%E0%A7%8D%E0%A6%A1-%E0%A6%87%E0%A7%9F%E0%A6%BE%E0%A6%B0%E0%A7%8D%E0%A6%A1%E0%A7%87-%E0%A6%9A%E0%A7%8B%E0%A6%B0%E0%A6%BE%E0%A6%87-%E0%A6%B2%E0%A6%BE%E0%A6%87%E0%A6%9F%E0%A6%BE%E0%A6%B0%E0%A7%87%E0%A6%9C-%E0%A6%9C%E0%A6%BE%E0%A6%B9%E0%A6%BE%E0%A6%9C-%E0%A6%95%E0%A6%BE%E0%A6%9F%E0%A6%BE%E0%A6%B0-%E0%A6%A7%E0%A7%81%E0%A6%AE-%E0%A6%B8%E0%A6%BF%E0%A6%A8%E0%A7%8D%E0%A6%A1%E0%A6%BF%E0%A6%95%E0%A7%87%E0%A6%9F%E0%A7%87%E0%A6%B0,সীতাকুণ্ড ইয়ার্ডে চোরাই লাইটারেজ জাহাজ কাটার ধুম সিন্ডিকেটের,চট্টগ্রামের সীতাকুণ্ড শিপইয়ার্ডে চোরাইপথে লাইটারেজ জাহাজ এনে কেটে অবাধে বিক্রি করা হচ্ছে। গত ছয় মাসে অবৈধভাবে শতাধিক জাহাজ কেটেছে মো. হামিদের নেতৃত্ব সাত-আটজনের সিন্ডিকেট।,2025-07-04
https://samakal.com/whole-country/article/303808/%E0%A6%B8%E0%A7%81%E0%A6%B7%E0%A7%8D%E0%A6%A0%E0%A7%81-%E0%A6%A8%E0%A6%BF%E0%A6%B0%E0%A7%8D%E0%A6%AC%E0%A6%BE%E0%A6%9A%E0%A6%A8%E0%A7%87%E0%A6%B0-%E0%A6%9C%E0%A6%A8%E0%A7%8D%E0%A6%AF-%E0%A6%AA%E0%A7%8D%E0%A6%B0%E0%A7%9F%E0%A7%8B%E0%A6%9C%E0%A6%A8%E0%A7%80%E0%A7%9F-%E0%A6%B8%E0%A6%82%E0%A6%B8%E0%A7%8D%E0%A6%95%E0%A6%BE%E0%A6%B0-%E0%A6%86%E0%A6%A6%E0%A6%BE%E0%A7%9F-%E0%A6%95%E0%A6%B0%E0%A7%87-%E0%A6%9B%E0%A6%BE%E0%A7%9C%E0%A6%AC:-%E0%A6%9C%E0%A6%BE%E0%A6%AE%E0%A6%BE%E0%A7%9F%E0%A6%BE%E0%A6%A4-%E0%A6%86%E0%A6%AE%E0%A6%BF%E0%A6%B0,সুষ্ঠু নির্বাচনের জন্য প্রয়োজনীয় সংস্কার আদায় করে ছাড়ব: জামায়াত আমির,"জামায়াতে ইসলামীর আমির ডা. শফিকুর রহমান বলেছেন, ‘সুষ্ঠু নির্বাচনের জন্য কতগুলো মৌলিক সংস্কার অবশ্যই করতে হবে। আমরা সেই সব সংস্কারের কথা বলেছি। সংস্কারগুলো আদায় করে ছাড়ব।’",2025-07-04
https://samakal.com/whole-country/article/303781/%E0%A6%A1%E0%A7%8B%E0%A6%AC%E0%A6%BE-%E0%A6%A5%E0%A7%87%E0%A6%95%E0%A7%87-%E0%A6%B6%E0%A6%BE%E0%A6%AA%E0%A6%B2%E0%A6%BE-%E0%A6%A4%E0%A7%81%E0%A6%B2%E0%A6%A4%E0%A7%87-%E0%A6%97%E0%A6%BF%E0%A7%9F%E0%A7%87-%E0%A6%AD%E0%A6%BE%E0%A6%87-%E0%A6%AC%E0%A7%8B%E0%A6%A8%E0%A7%87%E0%A6%B0-%E0%A6%AE%E0%A7%83%E0%A6%A4%E0%A7%8D%E0%A6%AF%E0%A7%81,ডোবা থেকে শাপলা তুলতে গিয়ে ভাই-বোনের মৃত্যু,"ব্রাহ্মণবাড়িয়ায় ডোবা থেকে শাপলা তুলতে গিয়ে পানিতে ডুবে ভাই-বোনের মৃত্যু হয়েছে। একদিন পর শুক্রবার সকালে ব্রাহ্মণবাড়িয়া পৌর এলাকার ভাদুঘর শান্তিনগরের একটি ডোবা থেকে মরদেহ উদ্ধার হয়। তারা হলো, শান্তিনগরের আক্কাস মিয়ার ছেলে হোসাইন (১১) ও তার বোন জিন্নাত (৮)।",2025-07-04
https://samakal.com/whole-country/article/303773/%E0%A6%97%E0%A7%8B%E0%A6%AA%E0%A6%BE%E0%A6%B2%E0%A6%97%E0%A6%9E%E0%A7%8D%E0%A6%9C%E0%A7%87-%E0%A6%AC%E0%A6%BE%E0%A6%B8%E0%A7%87%E0%A6%B0-%E0%A6%A7%E0%A6%BE%E0%A6%95%E0%A7%8D%E0%A6%95%E0%A6%BE%E0%A7%9F-%E0%A6%9F%E0%A7%8D%E0%A6%B0%E0%A6%BE%E0%A6%95%E0%A6%9A%E0%A6%BE%E0%A6%B2%E0%A6%95-%E0%A6%93-%E0%A6%B9%E0%A7%87%E0%A6%B2%E0%A6%AA%E0%A6%BE%E0%A6%B0-%E0%A6%A8%E0%A6%BF%E0%A6%B9%E0%A6%A4,গোপালগঞ্জে বাসের ধাক্কায় ট্রাকচালক ও হেলপার নিহত,গোপালগঞ্জে যাত্রীবাহী বাসের ধাক্কায় দুইজন নিহত হয়েছেন। এ সময় আহত হয়েছেন আরও একজন। আজ শুক্রবার ভোর রাতে ঢাকা-খুলনা মহাসড়কের গোপালগঞ্জ সদর উপজেলার ডুমদিয়ায় এ দুর্ঘটনা ঘটে।,2025-07-04
https://samakal.com/whole-country/article/303770/%E0%A6%97%E0%A6%BE%E0%A6%9C%E0%A7%80%E0%A6%AA%E0%A7%81%E0%A6%B0%E0%A7%87-%E0%A6%97%E0%A6%BE%E0%A6%B0%E0%A7%8D%E0%A6%AE%E0%A7%87%E0%A6%A8%E0%A7%8D%E0%A6%9F%E0%A6%B8-%E0%A6%B6%E0%A7%8D%E0%A6%B0%E0%A6%AE%E0%A6%BF%E0%A6%95-%E0%A6%B9%E0%A6%A4%E0%A7%8D%E0%A6%AF%E0%A6%BE%E0%A6%B0-%E0%A6%AC%E0%A6%BF%E0%A6%9A%E0%A6%BE%E0%A6%B0%E0%A7%87%E0%A6%B0-%E0%A6%A6%E0%A6%BE%E0%A6%AC%E0%A6%BF%E0%A6%A4%E0%A7%87-%E0%A6%95%E0%A6%BF%E0%A6%B6%E0%A7%8B%E0%A6%B0%E0%A6%97%E0%A6%9E%E0%A7%8D%E0%A6%9C%E0%A7%87-%E0%A6%AE%E0%A6%BE%E0%A6%A8%E0%A6%AC%E0%A6%AC%E0%A6%A8%E0%A7%8D%E0%A6%A7%E0%A6%A8%C2%A0,গাজীপুরে গার্মেন্টস শ্রমিক হত্যার বিচারের দাবিতে কিশোরগঞ্জে মানববন্ধন,গাজীপুরের কোনাবাড়িতে গার্মেন্টস কারখানায় বিদ্যুৎ শ্রমিক হৃদয় হত্যার বিচার দাবিতে কিশোরগঞ্জে মানববন্ধন কর্মসূচি পালিত হয়েছে। আজ শুক্রবার সকালে জেলার হোসেনপুরের গোবিন্দপুর চৌরাস্তায় বাংলাদেশ শ্রমিক কর্মচারী ফেডারেশন বিভিন্ন দাবি সংবলিত পোস্টার নিয়ে মানববন্ধনের আয়োজন করে। এ সময় বক্তব্য দেন সংগঠনের জেলা কমিটির সভাপতি মো. আলাল মিয়া ও সাধারণ সম্পাদক এবায়দুল ইসলাম।,2025-07-04
https://samakal.com/whole-country/article/303836/%E0%A6%AA%E0%A7%8D%E0%A6%B0%E0%A6%AC%E0%A6%BE%E0%A6%B8%E0%A7%80%E0%A6%B0-%E0%A6%9F%E0%A6%BE%E0%A6%95%E0%A6%BE-%E0%A6%97%E0%A7%8D%E0%A6%B0%E0%A6%BE%E0%A6%AE%E0%A6%AC%E0%A6%BE%E0%A6%B8%E0%A7%80%E0%A6%B0-%E0%A6%B6%E0%A7%8D%E0%A6%B0%E0%A6%AE%E0%A7%87-%E0%A7%A9-%E0%A6%95%E0%A6%BF%E0%A6%AE%E0%A6%BF-%E0%A6%B0%E0%A6%BE%E0%A6%B8%E0%A7%8D%E0%A6%A4%E0%A6%BE-%E0%A6%B8%E0%A6%82%E0%A6%B8%E0%A7%8D%E0%A6%95%E0%A6%BE%E0%A6%B0,"প্রবাসীর টাকা, গ্রামবাসীর শ্রমে ৩ কিমি রাস্তা সংস্কার",হবিগঞ্জের বাহুবলে স্বেচ্ছাশ্রমে প্রায় তিন কিলোমিটার দীর্ঘ একটি রাস্তা সংস্কারের কাজ শুরু করেছেন মিরপুর ইউনিয়নের পূর্ব লাকুড়িপাড়া গ্রামবাসী। দীর্ঘদিন ধরে বেহাল রাস্তাটি মেরামতে জনপ্রতিনিধিদের,2025-07-04
https://samakal.com/whole-country/article/303778/%E0%A6%AA%E0%A7%8D%E0%A6%B0%E0%A6%A4%E0%A6%BE%E0%A6%B0%E0%A6%A3%E0%A6%BE-%E0%A6%A0%E0%A7%87%E0%A6%95%E0%A6%BE%E0%A6%A4%E0%A7%87-%E0%A6%AA%E0%A6%BE%E0%A6%97%E0%A6%B2%E0%A6%BE-%E0%A6%AE%E0%A6%B8%E0%A6%9C%E0%A6%BF%E0%A6%A6%E0%A7%87-%E0%A6%A1%E0%A7%8B%E0%A6%A8%E0%A7%87%E0%A6%B6%E0%A6%A8-%E0%A6%93%E0%A7%9F%E0%A7%87%E0%A6%AC%E0%A6%B8%E0%A6%BE%E0%A6%87%E0%A6%9F-%E0%A6%89%E0%A6%A6%E0%A7%8D%E0%A6%AC%E0%A7%8B%E0%A6%A7%E0%A6%A8,প্রতারণা ঠেকাতে পাগলা মসজিদে ডোনেশন ওয়েবসাইট উদ্বোধন,কিশোরগঞ্জের ঐতিহাসিক পাগলা মসজিদে মানত গ্রহণের নামে প্রতারণা ঠেকাতে এবং মানতকারীদের ভোগান্তির অবসানে এবার উদ্বোধন করা হলো ডোনেশন ওয়োবসাইট। মসজিদ কমিটির সভাপতি জেলা প্রশাসক ফৌজিয়া খান শুক্রবার সকালে মসজিদ প্রাঙ্গনে আনুষ্ঠানিকভাবে নামে ওয়েবসাইটটি উদ্বোধন করেছেন।,2025-07-04
https://samakal.com/whole-country/article/303805/%E0%A6%A5%E0%A6%BE%E0%A6%A8%E0%A6%BE-%E0%A6%B9%E0%A6%BE%E0%A6%87%E0%A6%93%E0%A7%9F%E0%A7%87-%E0%A6%AA%E0%A7%81%E0%A6%B2%E0%A6%BF%E0%A6%B6%E0%A7%87%E0%A6%B0-%E0%A6%A0%E0%A7%87%E0%A6%B2%E0%A6%BE%E0%A6%A0%E0%A7%87%E0%A6%B2%E0%A6%BF%E0%A6%A4%E0%A7%87-%E0%A7%AF-%E0%A6%98%E0%A6%A3%E0%A7%8D%E0%A6%9F%E0%A6%BE-%E0%A6%B8%E0%A7%9C%E0%A6%95%E0%A7%87-%E0%A6%AA%E0%A7%9C%E0%A7%87-%E0%A6%9B%E0%A6%BF%E0%A6%B2-%E0%A6%B2%E0%A6%BE%E0%A6%B6,থানা-হাইওয়ে পুলিশের ঠেলাঠেলিতে ৯ ঘণ্টা সড়কে পড়ে ছিল লাশ,"নারায়ণগঞ্জের সিদ্ধিরগঞ্জের মৌচাক এলাকায় শুক্রবার ভোরে অজ্ঞাতপরিচয় এক ব্যক্তির লাশ পড়ে থাকতে দেখেন স্থানীয়রা। খবর পেয়ে সেখানে যায় থানা ও হাইওয়ে পুলিশ। ওই ব্যক্তি কীভাবে মারা গেছেন, তা নিশ্চিত হতে পারছিলেন না তারা। এ কারণে লাশ বুঝে নিতে থানা ও হাইওয়ে পুলিশের মধ্যে ঠেলাঠেলি চলতে থাকে। এক পর্যায়ে প্রায় ৯ ঘণ্টা পর দুপুরে লাশ উদ্ধার করে হাইওয়ে পুলিশ। গতকাল",2025-07-04
https://samakal.com/whole-country/article/303780/%E0%A6%9C%E0%A6%BE%E0%A6%AE%E0%A6%BE%E0%A7%9F%E0%A6%BE%E0%A6%A4%E0%A7%87%E0%A6%B0-%E0%A6%9C%E0%A6%A8%E0%A6%B8%E0%A6%AD%E0%A6%BE%E0%A7%9F-%E0%A6%A2%E0%A6%B2-%E0%A6%A8%E0%A7%87%E0%A6%AE%E0%A7%87%E0%A6%9B%E0%A7%87-%E0%A6%B0%E0%A6%82%E0%A6%AA%E0%A7%81%E0%A6%B0-%E0%A6%9C%E0%A6%BF%E0%A6%B2%E0%A6%BE-%E0%A6%B8%E0%A7%8D%E0%A6%95%E0%A7%81%E0%A6%B2-%E0%A6%AE%E0%A6%BE%E0%A6%A0%E0%A7%87,জামায়াতের জনসভায় ঢল নেমেছে রংপুর জিলা স্কুল মাঠে,জামায়াতের জনসভা শুরুর আগেই নেতাকর্মী সমর্থকদের ঢল নেমেছে রংপুর জিলা স্কুল মাঠে। জনসভার মাঠ ছাড়িয়ে আশপাশের এলাকায়ও মানুষের ভিড় করেছে। দীর্ঘ ১৭ পর রংপুরে অনুষ্ঠিত এই জনসভায় প্রধান অতিথি হিসেবে বক্তব্য রাখবেন জামায়াতে ইসলামীর আমির ডা. শফিকুর রহমান।,2025-07-04
