url,title,description,published_date
https://samakal.com/whole-country/article/303350/%E0%A6%A4%E0%A6%9C%E0%A7%81%E0%A6%AE%E0%A6%A6%E0%A7%8D%E0%A6%A6%E0%A6%BF%E0%A6%A8%E0%A7%87-%E0%A6%A8%E0%A6%BE%E0%A6%B0%E0%A7%80%E0%A6%95%E0%A7%87-%E0%A6%A6%E0%A6%B2%E0%A6%AC%E0%A6%A6%E0%A7%8D%E0%A6%A7-%E0%A6%A7%E0%A6%B0%E0%A7%8D%E0%A6%B7%E0%A6%A3:-%E0%A6%97%E0%A7%8D%E0%A6%B0%E0%A7%87%E0%A6%AA%E0%A7%8D%E0%A6%A4%E0%A6%BE%E0%A6%B0-%E0%A6%B9%E0%A7%9F%E0%A6%A8%E0%A6%BF-%E0%A6%AE%E0%A7%82%E0%A6%B2-%E0%A6%86%E0%A6%B8%E0%A6%BE%E0%A6%AE%E0%A6%BF%E0%A6%B0%E0%A6%BE,তজুমদ্দিনে নারীকে দলবদ্ধ ধর্ষণ: গ্রেপ্তার হয়নি মূল আসামিরা,ভোলার তজুমদ্দিন উপজেলায় চাঁদা না পেয়ে স্বামীকে বেঁধে মারধর ও স্ত্রীকে দলবদ্ধ ধর্ষণের ঘটনায় গ্রেপ্তার ঝর্ণা বেগমকে আদালতের মাধ্যমে জেল হাজতে পাঠানো হয়েছে। তবে গ্রেপ্তার হয়নি মামলার হয়নি মূল আসামিরা। এদিকে মামলার আসামিদের শাস্তির দাবিতে মানববন্ধন করেছে তজুমদ্দিন উপজেলা বিএনপি ও অঙ্গ সংগঠন। একই দাবিতে উপজেলার মোল্লা পুকুর এলাকায় মানববন্ধন করেন স্থানীয়রা। এতে দুই পক্ষের মধ্যে সংঘর্ষের ঘটনা ঘটে। অন্যদিকে গৃহবধূকে দলবদ্ধ ধর্ষণ মামলার দুই নম্বর আসামি উপজেলা শ্রমিক দলের যুগ্ম সাধারণ সম্পাদক মো. ফরিদ উদ্দিনকে সংগঠন থেকে বহিষ্কার করা হয়েছে। উপজেলা শ্রমিক দলের সভাপতি ইকবাল হোসেন লিটন ও সাধারণ সম্পাদক মো. সেলিমের সই করা বিজ্ঞপ্তিতে এ তথ্য জানানো হয়।,2025-07-02
https://samakal.com/whole-country/article/303336/%E0%A6%B8%E0%A6%AC-%E0%A6%AC%E0%A6%BE%E0%A6%A7%E0%A6%BE-%E0%A6%AA%E0%A7%87%E0%A6%B0%E0%A7%8B%E0%A6%A8%E0%A7%8B-%E0%A6%89%E0%A6%B2%E0%A7%8D%E0%A6%B2%E0%A6%BE%E0%A6%B8,সব বাধা পেরোনো উল্লাস,"জন্ম থেকেই দুই হাত ও দুই পা বাঁকা। স্বাভাবিকভাবে হাঁটতে পারতেন না। শৈশবে স্কুলে যেতেন বাবার কোলে চড়ে। সহপাঠীরা মাঠে খেলতেন, তিনি পাশে দাঁড়িয়ে দেখতেন। শারীরিক প্রতিবন্ধকতা যেন",2025-07-02
https://samakal.com/whole-country/article/303335/%E0%A6%93%E0%A7%9F%E0%A6%BE%E0%A6%B6%E0%A6%AC%E0%A7%8D%E0%A6%B2%E0%A6%95%E0%A7%87-%E0%A6%AA%E0%A6%BE%E0%A6%A8%E0%A6%BF-%E0%A6%A8%E0%A6%BE-%E0%A6%A5%E0%A6%BE%E0%A6%95%E0%A6%BE%E0%A7%9F-%E0%A6%AC%E0%A6%BF%E0%A6%AA%E0%A6%BE%E0%A6%95%E0%A7%87-%E0%A6%B6%E0%A6%BF%E0%A6%95%E0%A7%8D%E0%A6%B7%E0%A6%BE%E0%A6%B0%E0%A7%8D%E0%A6%A5%E0%A7%80%E0%A6%B0%E0%A6%BE,ওয়াশব্লকে পানি না থাকায় বিপাকে শিক্ষার্থীরা,তাহিরপুর মডেল সরকারি প্রাথমিক বিদ্যালয়ের পানি সরবরাহের লাইন বন্ধ থাকায় সব ওয়াশব্লক ব্যবহারের অনুপযোগী হয়ে পড়েছে। গত জানুয়ারি থেকে চলছে এই দুর্ভোগ।,2025-07-02
https://samakal.com/whole-country/article/303334/%E0%A6%95%E0%A6%BE%E0%A6%9C%E0%A7%87-%E0%A6%86%E0%A6%B8%E0%A6%9B%E0%A7%87-%E0%A6%A8%E0%A6%BE-%E0%A7%AB%E0%A7%A9-%E0%A6%B2%E0%A6%BE%E0%A6%96-%E0%A6%9F%E0%A6%BE%E0%A6%95%E0%A6%BE%E0%A7%9F-%E0%A6%A8%E0%A6%BF%E0%A6%B0%E0%A7%8D%E0%A6%AE%E0%A6%BF%E0%A6%A4-%E0%A6%A8%E0%A7%8D%E0%A6%AF%E0%A6%BE%E0%A7%9F%E0%A6%95%E0%A7%81%E0%A6%9E%E0%A7%8D%E0%A6%9C,কাজে আসছে না ৫৩ লাখ টাকায় নির্মিত ন্যায়কুঞ্জ,হবিগঞ্জ আদালত প্রাঙ্গণে বিচারপ্রার্থীদের জন্য বিশ্রামাগার নিশ্চিতের লক্ষ্যে তৈরি করা হয় ‘ন্যায়কুঞ্জ’। নির্মাণ শেষে সেটি উদ্বোধন করলেও এর সুফল ভোগ করতে পারছেন না বিচারপ্রার্থীরা।,2025-07-02
https://samakal.com/whole-country/article/303332/%E0%A6%96%E0%A7%87%E0%A7%9F%E0%A7%87-%E0%A6%A8%E0%A6%BE-%E0%A6%96%E0%A7%87%E0%A7%9F%E0%A7%87-%E0%A6%A6%E0%A6%BF%E0%A6%A8-%E0%A6%95%E0%A6%BE%E0%A6%9F%E0%A7%87-%E0%A6%B0%E0%A6%AB%E0%A6%BF%E0%A6%95%E0%A7%81%E0%A6%B2-%E0%A6%B0%E0%A7%87%E0%A6%B9%E0%A6%BE%E0%A6%A8%E0%A6%BE-%E0%A6%A6%E0%A6%AE%E0%A7%8D%E0%A6%AA%E0%A6%A4%E0%A6%BF%E0%A6%B0,খেয়ে না খেয়ে দিন কাটে রফিকুল-রেহানা দম্পতির,বগুড়া জেলার নন্দীগ্রাম পৌরসভার গুন্দইল গ্রামের রেহানা-রফিকুল দম্পতির সন্তান নেই। বাস করেন টিনের খুপরি ঘরে। দু’জনই অসুস্থ। চলাফেরা করতে পারেন না। চিকিৎসা করানোর সামর্থ্য নেই। অর্ধাহার-,2025-07-02
https://samakal.com/whole-country/article/303331/%E0%A6%97%E0%A6%BE%E0%A6%AB%E0%A6%BF%E0%A6%B2%E0%A6%A4%E0%A6%BF-%E0%A6%86%E0%A6%B0-%E0%A6%85%E0%A6%B8%E0%A6%BE%E0%A6%AC%E0%A6%A7%E0%A6%BE%E0%A6%A8%E0%A6%A4%E0%A6%BE%E0%A7%9F-%E0%A6%AA%E0%A7%8D%E0%A6%B0%E0%A6%BE%E0%A6%A3-%E0%A6%B9%E0%A6%BE%E0%A6%B0%E0%A6%BE%E0%A6%9A%E0%A7%8D%E0%A6%9B%E0%A7%87-%E0%A6%B6%E0%A6%BF%E0%A6%B6%E0%A7%81-%E0%A6%9C%E0%A6%BE%E0%A6%A8%E0%A7%87-%E0%A6%A8%E0%A6%BE-%E0%A6%B8%E0%A6%BE%E0%A6%81%E0%A6%A4%E0%A6%BE%E0%A6%B0,"গাফিলতি আর অসাবধানতায় প্রাণ হারাচ্ছে শিশু, জানে না সাঁতার",পারিবারিক কাজে ব্যস্ত ছিলেন মা। এ সুযোগে কাউকে কিছু না বলে ১০ বছরের আফিয়া ও ৮ বছরের মিম বাড়ির পাশে নতুন খনন করা পুকুরে গোসল করতে নামে। ঘণ্টাখানেক পর পরিবারের লোকজন,2025-07-02
https://samakal.com/whole-country/article/303424/%E0%A6%AE%E0%A6%BE%E0%A6%A6%E0%A6%95-%E0%A6%B8%E0%A7%87%E0%A6%AC%E0%A6%A8%E0%A7%87-%E0%A6%AC%E0%A6%BE%E0%A6%A7%E0%A6%BE-%E0%A6%A6%E0%A7%87%E0%A6%93%E0%A7%9F%E0%A6%BE%E0%A7%9F-%E0%A6%8F%E0%A6%87%E0%A6%9A%E0%A6%8F%E0%A6%B8%E0%A6%B8%E0%A6%BF-%E0%A6%AA%E0%A6%B0%E0%A7%80%E0%A6%95%E0%A7%8D%E0%A6%B7%E0%A6%BE%E0%A6%B0%E0%A7%8D%E0%A6%A5%E0%A7%80-%E0%A6%96%E0%A7%81%E0%A6%A8-%E0%A6%AC%E0%A6%BE%E0%A6%AC%E0%A6%BE-%E0%A6%97%E0%A7%81%E0%A6%B0%E0%A7%81%E0%A6%A4%E0%A6%B0-%E0%A6%86%E0%A6%B9%E0%A6%A4,"মাদক সেবনে বাধা দেওয়ায় এইচএসসি পরীক্ষার্থী খুন, বাবা গুরুতর আহত",এ ঘটনায় তার পিতা জাকির হোসেন বয়াতিও গুরুতর আহত হয়ে হাসপাতালে চিকিৎসাধীন।,2025-07-02
https://samakal.com/whole-country/article/303433/%E0%A6%AC%E0%A7%8D%E0%A6%B0%E0%A6%B9%E0%A7%8D%E0%A6%AE%E0%A6%AA%E0%A7%81%E0%A6%A4%E0%A7%8D%E0%A6%B0-%E0%A6%A8%E0%A6%A6%E0%A7%87-%E0%A6%A8%E0%A7%8C%E0%A6%95%E0%A6%BE%E0%A6%A1%E0%A7%81%E0%A6%AC%E0%A6%BF%E0%A6%A4%E0%A7%87-%E0%A6%A8%E0%A6%BF%E0%A6%96%E0%A7%8B%E0%A6%81%E0%A6%9C-%E0%A6%A6%E0%A7%81%E0%A6%87-%E0%A6%B6%E0%A6%BF%E0%A6%B6%E0%A7%81%E0%A6%B0-%E0%A6%AE%E0%A6%B0%E0%A6%A6%E0%A7%87%E0%A6%B9-%E0%A6%89%E0%A6%A6%E0%A7%8D%E0%A6%A7%E0%A6%BE%E0%A6%B0%C2%A0,ব্রহ্মপুত্র নদে নৌকাডুবিতে নিখোঁজ দুই শিশুর মরদেহ উদ্ধার,ময়মনসিংহের গফরগাঁও উপজেলার পাগলা থানার বাশিয়া এলাকায় ব্রহ্মপুত্র নদে নৌকাডুবির ঘটনায় নিখোঁজ দুই শিশুর মরদেহ উদ্ধার করা হয়েছে।,2025-07-02
https://samakal.com/whole-country/article/303432/%E0%A6%9A%E0%A6%9F%E0%A7%8D%E0%A6%9F%E0%A6%97%E0%A7%8D%E0%A6%B0%E0%A6%BE%E0%A6%AE-%E0%A6%B0%E0%A7%87%E0%A6%9E%E0%A7%8D%E0%A6%9C-%E0%A6%A1%E0%A6%BF%E0%A6%86%E0%A6%87%E0%A6%9C%E0%A6%BF%E0%A6%B0-%E0%A6%95%E0%A6%BE%E0%A6%B0%E0%A7%8D%E0%A6%AF%E0%A6%BE%E0%A6%B2%E0%A7%9F%E0%A7%87%E0%A6%B0-%E0%A6%B8%E0%A6%BE%E0%A6%AE%E0%A6%A8%E0%A7%87-%E0%A6%8F%E0%A6%A8%E0%A6%B8%E0%A6%BF%E0%A6%AA%E0%A6%BF-%E0%A6%93-%E0%A6%AC%E0%A7%88%E0%A6%B7%E0%A6%AE%E0%A7%8D%E0%A6%AF%E0%A6%AC%E0%A6%BF%E0%A6%B0%E0%A7%8B%E0%A6%A7%E0%A7%80%E0%A6%A6%E0%A7%87%E0%A6%B0-%E0%A6%AC%E0%A6%BF%E0%A6%95%E0%A7%8D%E0%A6%B7%E0%A7%8B%E0%A6%AD%C2%A0,চট্টগ্রাম রেঞ্জ ডিআইজির কার্যালয়ের সামনে এনসিপি ও বৈষম্যবিরোধীদের বিক্ষোভ,চট্টগ্রামে রেঞ্জ ডিআইজি কার্যালয়ের সামনে অবস্থান নিয়ে বিক্ষোভ করছে জাতীয় নাগরিক পার্টি (এনসিপি) ও বৈষম্যবিরোধী ছাত্র আন্দোলন। পটিয়ায় বৈষম্যবিরোধী ছাত্র আন্দোলনের শিক্ষার্থীদের ওপর হামলার প্রতিবাদে এ বিক্ষোভ করছেন তারা।,2025-07-02
https://samakal.com/whole-country/article/303469/%E0%A6%B6%E0%A6%BF%E0%A6%95%E0%A7%8D%E0%A6%B7%E0%A6%95%E0%A7%87%E0%A6%B0-%E0%A6%9A%E0%A7%9C%E0%A6%A5%E0%A6%BE%E0%A6%AA%E0%A7%8D%E0%A6%AA%E0%A7%9C%E0%A7%87-%E0%A6%A8%E0%A6%BE%E0%A6%95-%E0%A6%AB%E0%A6%BE%E0%A6%9F%E0%A6%B2-%E0%A6%9B%E0%A6%BE%E0%A6%A4%E0%A7%8D%E0%A6%B0%E0%A7%87%E0%A6%B0,শিক্ষকের চড়থাপ্পড়ে নাক ফাটল ছাত্রের,শিক্ষকের অনুমতি নিয়ে শ্রেণিকক্ষের বাইরে যায় দ্বিতীয় শ্রেণির ছাত্র সোয়াদ হোসেন। ফিরতে দেরি হওয়ায় শিক্ষকের চড়থাপ্পড়ে তার নাক ফেটে যায়। বুধবার চাটমোহর উপজেলার কানাইরচর সরকারি প্রাথমিক বিদ্যালয়ে ঘটনাটি ঘটে।,2025-07-02
https://samakal.com/whole-country/article/303435/%E0%A6%9C%E0%A6%AE%E0%A6%BF-%E0%A6%B2%E0%A6%BF%E0%A6%96%E0%A7%87-%E0%A6%A8%E0%A6%BF%E0%A7%9F%E0%A7%87-%E0%A6%AC%E0%A6%BE%E0%A6%AC%E0%A6%BE-%E0%A6%AE%E0%A6%BE%E0%A6%95%E0%A7%87-%E0%A6%AC%E0%A6%BE%E0%A7%9C%E0%A6%BF%E0%A6%9B%E0%A6%BE%E0%A7%9C%E0%A6%BE-%E0%A6%95%E0%A6%B0%E0%A6%B2%E0%A7%87%E0%A6%A8-%E0%A6%A6%E0%A7%81%E0%A6%87-%E0%A6%9B%E0%A7%87%E0%A6%B2%E0%A7%87,জমি লিখে নিয়ে বাবা-মাকে বাড়িছাড়া করলেন দুই ছেলে,এ ঘটনায় ভুক্তভোগী কৃষক ছানোয়ার হোসেন মন্ডল (৬৭) তাড়াশ উপজেলা নির্বাহী কর্মকর্তা (ইউএনও) বরাবর লিখিত অভিযোগ করেছেন।,2025-07-02
https://samakal.com/whole-country/article/303497/%E0%A6%AC%E0%A7%88%E0%A6%B7%E0%A6%AE%E0%A7%8D%E0%A6%AF%E0%A6%AC%E0%A6%BF%E0%A6%B0%E0%A7%8B%E0%A6%A7%E0%A7%80-%E0%A6%8F%E0%A6%A8%E0%A6%B8%E0%A6%BF%E0%A6%AA%E0%A6%BF%E0%A6%B0-%E0%A6%86%E0%A6%A8%E0%A7%8D%E0%A6%A6%E0%A7%8B%E0%A6%B2%E0%A6%A8%E0%A7%87%E0%A6%B0-%E0%A6%AE%E0%A7%81%E0%A6%96%E0%A7%87-%E0%A6%AA%E0%A6%9F%E0%A6%BF%E0%A7%9F%E0%A6%BE-%E0%A6%A5%E0%A6%BE%E0%A6%A8%E0%A6%BE%E0%A6%B0-%E0%A6%93%E0%A6%B8%E0%A6%BF-%E0%A6%9C%E0%A6%BE%E0%A7%9F%E0%A7%87%E0%A6%A6-%E0%A6%A8%E0%A7%81%E0%A6%B0%E0%A6%95%E0%A7%87-%E0%A6%AA%E0%A7%8D%E0%A6%B0%E0%A6%A4%E0%A7%8D%E0%A6%AF%E0%A6%BE%E0%A6%B9%E0%A6%BE%E0%A6%B0,বৈষম্যবিরোধী-এনসিপির আন্দোলনের মুখে পটিয়া থানার ওসি জায়েদ নুরকে প্রত্যাহার,চট্টগ্রামের পটিয়া থানার ভারপ্রাপ্ত কর্মকর্তা (ওসি) আবু জায়েদ মো. নাজমুন নূরকে আজ বুধবার রাত সাড়ে ১০টার দিকে প্রত্যাহার করা হয়েছে। বৈষম্যবিরোধী ছাত্র আন্দোলন ও জাতীয় নাগরিক কমিটির (এনসিপি) আন্দোলনের মুখে তাকে প্রত্যাহার করা হয়।,2025-07-02
https://samakal.com/whole-country/article/303496/%E0%A6%B8%E0%A6%BE%E0%A6%AC%E0%A7%87%E0%A6%95-%E0%A6%97%E0%A6%A3%E0%A6%B6%E0%A6%BF%E0%A6%95%E0%A7%8D%E0%A6%B7%E0%A6%BE-%E0%A6%AA%E0%A7%8D%E0%A6%B0%E0%A6%A4%E0%A6%BF%E0%A6%AE%E0%A6%A8%E0%A7%8D%E0%A6%A4%E0%A7%8D%E0%A6%B0%E0%A7%80%E0%A6%B0-%E0%A6%AC%E0%A6%BE%E0%A7%9C%E0%A6%BF%E0%A6%B0-%E0%A6%97%E0%A7%87%E0%A6%9F%E0%A7%87-%E0%A6%A6%E0%A7%81%E0%A6%A6%E0%A6%95%E0%A7%87%E0%A6%B0-%E0%A7%A9-%E0%A6%A8%E0%A7%8B%E0%A6%9F%E0%A6%BF%E0%A6%B6,সাবেক গণশিক্ষা প্রতিমন্ত্রীর বাড়ির গেটে দুদকের ৩ নোটিশ,"সাবেক প্রাথমিক ও গণশিক্ষা প্রতিমন্ত্রী জাকির হোসেনের স্ত্রী সুরাইয়া সুলতানা, ছেলে সাফায়াত বিন জাকির ওরফে সৌরভ ও মেয়ে জাকিয়া তাবাসসুম সঞ্চয়ীর সম্পত্তির হিসাব চেয়েছে দুর্নীতি দমন কমিশন (দুদক)। দুদকের প্রধান কার্যালয় থেকে পাঠানো পৃথক তিনটি চিঠিতে ওই নোটিশ জারি করা হয়েছে।",2025-07-02
https://samakal.com/whole-country/article/303492/%E0%A7%AD-%E0%A6%98%E0%A6%A3%E0%A7%8D%E0%A6%9F%E0%A6%BE-%E0%A6%AA%E0%A6%B0-%E0%A6%9A%E0%A6%9F%E0%A7%8D%E0%A6%9F%E0%A6%97%E0%A7%8D%E0%A6%B0%E0%A6%BE%E0%A6%AE-%E0%A6%95%E0%A6%95%E0%A7%8D%E0%A6%B8%E0%A6%AC%E0%A6%BE%E0%A6%9C%E0%A6%BE%E0%A6%B0-%E0%A6%AE%E0%A6%B9%E0%A6%BE%E0%A6%B8%E0%A7%9C%E0%A6%95%E0%A7%87-%E0%A6%AF%E0%A6%BE%E0%A6%A8-%E0%A6%9A%E0%A6%B2%E0%A6%BE%E0%A6%9A%E0%A6%B2-%E0%A6%B8%E0%A7%8D%E0%A6%AC%E0%A6%BE%E0%A6%AD%E0%A6%BE%E0%A6%AC%E0%A6%BF%E0%A6%95,৭ ঘণ্টা পর চট্টগ্রাম-কক্সবাজার মহাসড়কে যান চলাচল স্বাভাবিক,চট্টগ্রাম-কক্সবাজার মহাসড়কে যান চলাচল স্বাভাবিক হতে শুরু করেছে। গত মঙ্গলবার রাতে ছাত্রলীগ নেতাকে গ্রেপ্তার না করার জের ধরে পটিয়ায় পুলিশের সঙ্গে সংঘর্ষে ও পুলিশের পিটুনিতে ছাত্র সমন্বয়কের ৭ সদস্যসহ ১১ জন আহত হওয়ার ঘটনা ঘটেছে।,2025-07-02
https://samakal.com/whole-country/article/303489/%E0%A6%AC%E0%A6%99%E0%A7%8D%E0%A6%97%E0%A7%8B%E0%A6%AA%E0%A6%B8%E0%A6%BE%E0%A6%97%E0%A6%B0%E0%A7%87-%E0%A6%9F%E0%A7%8D%E0%A6%B0%E0%A6%B2%E0%A6%BE%E0%A6%B0%E0%A6%A1%E0%A7%81%E0%A6%AC%E0%A6%BF-%E0%A6%A4%E0%A6%BF%E0%A6%A8-%E0%A6%98%E0%A6%A3%E0%A7%8D%E0%A6%9F%E0%A6%BE-%E0%A6%AA%E0%A6%B0-%E0%A7%AD-%E0%A6%9C%E0%A7%87%E0%A6%B2%E0%A7%87-%E0%A6%89%E0%A6%A6%E0%A7%8D%E0%A6%A7%E0%A6%BE%E0%A6%B0,"বঙ্গোপসাগরে ট্রলারডুবি, তিন ঘণ্টা পর ৭ জেলে উদ্ধার",পটুয়াখালীর কুয়াকাটা সংলগ্ন উত্তাল বঙ্গোপসাগরে ট্রলারে করে মাছ শিকারে গিয়ে ৭ জেলেসহ ট্রলার ডুবির ঘটনা ঘটে। আজ বুধবার দুপুর ৩টার দিকে তাদের উদ্ধার করা হয়।,2025-07-02
https://samakal.com/whole-country/article/303488/%E0%A6%B8%E0%A6%BE%E0%A6%B0%E0%A7%8D%E0%A6%AC%E0%A6%AD%E0%A7%8C%E0%A6%AE%E0%A6%A4%E0%A7%8D%E0%A6%AC-%E0%A6%93-%E0%A6%9C%E0%A6%BE%E0%A6%A4%E0%A7%80%E0%A7%9F-%E0%A6%B8%E0%A6%AE%E0%A7%8D%E0%A6%AA%E0%A6%A6-%E0%A6%B0%E0%A6%95%E0%A7%8D%E0%A6%B7%E0%A6%BE%E0%A6%B0-%E0%A6%A6%E0%A6%BE%E0%A6%AC%E0%A6%BF%E0%A6%A4%E0%A7%87-%E0%A6%AF%E0%A6%B6%E0%A7%8B%E0%A6%B0%E0%A7%87-%E0%A6%AE%E0%A6%B6%E0%A6%BE%E0%A6%B2-%E0%A6%AE%E0%A6%BF%E0%A6%9B%E0%A6%BF%E0%A6%B2,সার্বভৌমত্ব ও জাতীয় সম্পদ রক্ষার দাবিতে যশোরে মশাল মিছিল,যশোরে স্বাধীনতা সার্বভৌমত্ব ও জাতীয় সম্পদ রক্ষা আন্দোলনের উদ্যোগে প্রতিবাদী সমাবেশ ও মশাল মিছিল হয়েছে।,2025-07-02
https://samakal.com/whole-country/article/303483/%E0%A6%B8%E0%A6%BE%E0%A6%A4-%E0%A6%AC%E0%A6%9B%E0%A6%B0-%E0%A6%AA%E0%A6%B0-%E0%A6%B8%E0%A6%BE%E0%A6%AC%E0%A7%87%E0%A6%95-%E0%A6%8F%E0%A6%B8%E0%A6%AA%E0%A6%BF-%E0%A6%87%E0%A6%89%E0%A6%8F%E0%A6%A8%E0%A6%93-%E0%A6%93-%E0%A6%93%E0%A6%B8%E0%A6%BF%E0%A6%B0-%E0%A6%A8%E0%A6%BE%E0%A6%AE%E0%A7%87-%E0%A6%AE%E0%A6%BE%E0%A6%AE%E0%A6%B2%E0%A6%BE,"মাগুরায় ছাত্রদল নেতাকে নির্যাতন / সাত বছর পর সাবেক এসপি, ইউএনও ও ওসির নামে মামলা","মাগুরায় ছাত্রদলের সাবেক এক নেতাকে মিথ্যা মামলায় আটক করে নির্যাতন এবং বিনা বিচারে ১৬৮ দিন কারাবন্দি রাখার অভিযোগে সাবেক পুলিশ সুপার (এসপি), ওসি, উপজেলা নির্বাহী কর্মকর্তাসহ ৯ জনের বিরুদ্ধে মামলা হয়েছে। ঘটনার প্রায় সাত বছর পর গত সোমবার মাগুরা সদর আমলি আদালতে অভিযোগটি করেন ছাত্রদলের সাবেক সহসাংগঠনিক সম্পাদক ফয়সাল রুমন।",2025-07-02
https://samakal.com/whole-country/article/303481/%E0%A6%B8%E0%A6%BE%E0%A6%A4%E0%A6%95%E0%A6%BE%E0%A6%A8%E0%A6%BF%E0%A7%9F%E0%A6%BE%E0%A7%9F-%E0%A6%AE%E0%A6%BE%E0%A6%A6%E0%A6%95-%E0%A6%95%E0%A6%BE%E0%A6%B0%E0%A6%AC%E0%A6%BE%E0%A6%B0%E0%A6%BF%E0%A6%A6%E0%A7%87%E0%A6%B0-%E0%A6%B9%E0%A6%BE%E0%A6%AE%E0%A6%B2%E0%A6%BE%E0%A7%9F-%E0%A6%9A%E0%A6%BE%E0%A6%B0%E0%A6%9C%E0%A6%A8-%E0%A6%86%E0%A6%B9%E0%A6%A4,সাতকানিয়ায় মাদক কারবারিদের হামলায় চারজন আহত,চট্টগ্রামের সাতকানিয়াযর কালিয়াইশ ইউনিয়নে চট্টগ্রাম-কক্সবাজার মহাসড়কের মৌলভীর দোকান এলাকায় মঙ্গলবার রাতে মাদক কারবারে বাধা দেওয়ায় হামলা হয়েছে। এতে ছাত্রশিবিরের চার নেতাকর্মী আহত হয়েছেন।,2025-07-02
https://samakal.com/whole-country/article/303480/%E0%A6%A6%E0%A6%B6%E0%A6%AE%E0%A6%BF%E0%A6%A8%E0%A6%BE%E0%A7%9F-%E0%A6%9B%E0%A7%81%E0%A6%B0%E0%A6%BF%E0%A6%95%E0%A6%BE%E0%A6%98%E0%A6%BE%E0%A6%A4%E0%A7%87-%E0%A6%A4%E0%A6%B0%E0%A7%81%E0%A6%A3-%E0%A6%B9%E0%A6%A4%E0%A7%8D%E0%A6%AF%E0%A6%BE-%E0%A6%9A%E0%A6%BE%E0%A6%B0-%E0%A6%AC%E0%A6%BE%E0%A7%9C%E0%A6%BF%E0%A6%A4%E0%A7%87-%E0%A6%86%E0%A6%97%E0%A7%81%E0%A6%A8,"মাদক কারবারে বাধা / দশমিনায় ছুরিকাঘাতে তরুণ হত্যা, চার বাড়িতে আগুন",পটুয়াখালীর দশমিনায় মাদক কারবারে বাধা দেওয়ায় ফাহিম হোসেনকে (১৮) ছুরিকাঘাতে হত্যার অভিযোগ উঠেছে শাকিল মীরের (২৪) বিরুদ্ধে। এ সময় ছেলেকে রক্ষা করতে গেলে জাকির হোসেন বয়াতীকেও ছুরিকাঘাতে আহত করা হয়। দুই,2025-07-02
https://samakal.com/whole-country/article/303478/%E0%A6%86%E0%A6%A6%E0%A6%BF%E0%A6%AC%E0%A6%BE%E0%A6%B8%E0%A7%80-%E0%A6%A4%E0%A6%B0%E0%A7%81%E0%A6%A3%E0%A6%A6%E0%A7%87%E0%A6%B0-%E0%A6%9C%E0%A6%A8%E0%A7%8D%E0%A6%AF-%E0%A6%B8%E0%A6%BE%E0%A6%82%E0%A6%B8%E0%A7%8D%E0%A6%95%E0%A7%83%E0%A6%A4%E0%A6%BF%E0%A6%95-%E0%A6%90%E0%A6%A4%E0%A6%BF%E0%A6%B9%E0%A7%8D%E0%A6%AF-%E0%A6%B8%E0%A6%82%E0%A6%B0%E0%A6%95%E0%A7%8D%E0%A6%B7%E0%A6%A3%E0%A7%87%E0%A6%B0-%E0%A6%93%E0%A6%AA%E0%A6%B0-%E0%A6%97%E0%A7%81%E0%A6%B0%E0%A7%81%E0%A6%A4%E0%A7%8D%E0%A6%AC%E0%A6%BE%E0%A6%B0%E0%A7%8B%E0%A6%AA,কক্সবাজারে আবাসিক কর্মশালা / আদিবাসী তরুণদের জন্য সাংস্কৃতিক ঐতিহ্য সংরক্ষণের ওপর গুরুত্বারোপ,আদিবাসী তরুণদের জন্য সাংস্কৃতিক ঐতিহ্য সংরক্ষণের ওপর গুরুত্বারোপ করে তিন দিনব্যাপী আবাসিক কর্মশালা অনুষ্ঠিত হয়েছে।,2025-07-02
https://samakal.com/whole-country/article/303475/%E0%A6%AC%E0%A6%BF%E0%A6%8F%E0%A6%B8%E0%A6%8F%E0%A6%AB%E0%A7%87%E0%A6%B0-%E0%A6%97%E0%A7%81%E0%A6%B2%E0%A6%BF%E0%A6%A4%E0%A7%87-%E0%A6%AC%E0%A6%BE%E0%A6%82%E0%A6%B2%E0%A6%BE%E0%A6%A6%E0%A7%87%E0%A6%B6%E0%A6%BF-%E0%A6%A8%E0%A6%BF%E0%A6%B9%E0%A6%A4,বিএসএফের গুলিতে বাংলাদেশি নিহত,চুয়াডাঙ্গার দামুড়হুদা উপজেলার ঝাঁঝাডাঙ্গা সীমান্তে ভারতীয় সীমান্তরক্ষী বাহিনী বিএসএফের গুলিতে ইব্রাহিম বাবু (৩২) নামের এক বাংলাদেশি যুবক নিহত হয়েছেন। বুধবার দুপুরে সীমান্তের ৭৯ নম্বর আন্তর্জাতিক মেইন পিলারের প্রায় ২০০ গজ ভেতরে এ ঘটনা ঘটে।,2025-07-02
https://samakal.com/whole-country/article/303473/%E0%A6%B8%E0%A6%BE%E0%A6%AC%E0%A7%87%E0%A6%95-%E0%A6%8F%E0%A6%AE%E0%A6%AA%E0%A6%BF-%E0%A6%9C%E0%A6%BE%E0%A6%AB%E0%A6%B0-%E0%A6%86%E0%A6%B2%E0%A6%AE-%E0%A6%AB%E0%A7%87%E0%A6%B0-%E0%A6%B0%E0%A6%BF%E0%A6%AE%E0%A6%BE%E0%A6%A8%E0%A7%8D%E0%A6%A1%E0%A7%87,সাবেক এমপি জাফর আলম ফের রিমান্ডে,কক্সবাজার-১ (চকরিয়া-পেকুয়া) আসনের সাবেক এমপি ও চকরিয়া উপজেলা আওয়ামী লীগের সভাপতি জাফর আলমকে আরও সাত দিনের রিমান্ডে নিয়েছে পুলিশ।,2025-07-02
https://samakal.com/whole-country/article/303490/%E0%A6%B8%E0%A7%87%E0%A6%87-%E0%A6%A8%E0%A6%BE%E0%A6%B0%E0%A7%80%E0%A6%B0-%E0%A6%A1%E0%A6%BF%E0%A6%8F%E0%A6%A8%E0%A6%8F-%E0%A6%AA%E0%A6%B0%E0%A7%80%E0%A6%95%E0%A7%8D%E0%A6%B7%E0%A6%BE-%E0%A6%A8%E0%A6%BF%E0%A7%9F%E0%A7%87-%E0%A6%8F%E0%A6%97%E0%A7%8B%E0%A6%9A%E0%A7%8D%E0%A6%9B%E0%A7%87-%E0%A6%AA%E0%A7%81%E0%A6%B2%E0%A6%BF%E0%A6%B6,মুরাদনগরে নিপীড়ন / সেই নারীর ডিএনএ পরীক্ষা নিয়ে এগোচ্ছে পুলিশ,কুমিল্লার মুরাদনগরে ধর্ষণ ও নির্যাতনের পর সেই নারীর ডাক্তারি পরীক্ষা না হওয়ায় গভীর উদ্বেগ প্রকাশ করেছেন মানবাধিকারকর্মী ও আইন বিশেষজ্ঞরা।,2025-07-02
