url,title,description,published_date
https://samakal.com/whole-country/article/303104/%E0%A6%B6%E0%A6%BF%E0%A6%95%E0%A7%8D%E0%A6%B7%E0%A6%95%E0%A6%95%E0%A7%87-%E0%A6%96%E0%A7%81%E0%A6%81%E0%A6%9F%E0%A6%BF%E0%A6%A4%E0%A7%87-%E0%A6%AC%E0%A7%87%E0%A6%81%E0%A6%A7%E0%A7%87-%E0%A6%AE%E0%A6%BE%E0%A6%B0%E0%A6%A7%E0%A6%B0-%E0%A6%97%E0%A7%8D%E0%A6%B0%E0%A7%87%E0%A6%AA%E0%A7%8D%E0%A6%A4%E0%A6%BE%E0%A6%B0-%E0%A7%A8,"শিক্ষককে খুঁটিতে বেঁধে মারধর, গ্রেপ্তার ২",চট্টগ্রামের সাতকানিয়ায় একটি মাধ্যমিক বিদ্যালয়ের প্রধান শিক্ষককে খুঁটিতে বেঁধে মারধরের ঘটনায় করা মামলায় দুই আসামিকে গ্রেপ্তার করেছে পুলিশ। রোববার রাতে উপজেলার কেঁওচিয়া ইউনিয়নের ৩ নম্বর ওয়ার্ড এলাকা থেকে তাদের গ্রেপ্তার করা হয়।,2025-06-30
https://samakal.com/whole-country/article/303099/%E0%A6%AC%E0%A7%87%E0%A6%A8%E0%A6%BE%E0%A6%AA%E0%A7%8B%E0%A6%B2-%E0%A6%AC%E0%A6%A8%E0%A7%8D%E0%A6%A6%E0%A6%B0%E0%A7%87-%E0%A6%86%E0%A6%AE%E0%A6%A6%E0%A6%BE%E0%A6%A8%E0%A6%BF-%E0%A6%B0%E0%A6%AA%E0%A7%8D%E0%A6%A4%E0%A6%BE%E0%A6%A8%E0%A6%BF-%E0%A6%93-%E0%A6%AA%E0%A6%A3%E0%A7%8D%E0%A6%AF-%E0%A6%96%E0%A6%BE%E0%A6%B2%E0%A6%BE%E0%A6%B8-%E0%A6%B6%E0%A7%81%E0%A6%B0%E0%A7%81,শাটডাউন কর্মসূচি প্রত্যাহার / বেনাপোল বন্দরে আমদানি-রপ্তানি ও পণ্য খালাস শুরু,এনবিআর সংস্কার ঐক্য পরিষদ কমপ্লিট শাটডাউন কর্মসূচি প্রত্যাহার করায় আজ সোমবার সকাল থেকে বেনাপোল বন্দর দিয়ে ভারত-বাংলাদেশের মধ্যে আমদানি-রপ্তানি বাণিজ্য ও পণ্য খালাস কার্যক্রম শুরু হয়েছে।,2025-06-30
https://samakal.com/whole-country/article/303098/%E0%A6%87%E0%A6%B6%E0%A6%BE%E0%A6%B0%E0%A6%BE-%E0%A6%AD%E0%A6%BE%E0%A6%B7%E0%A6%BE%E0%A6%B0-%E0%A6%B8%E0%A6%B9%E0%A6%BE%E0%A7%9F%E0%A6%A4%E0%A6%BE%E0%A7%9F-%E0%A6%B8%E0%A7%87%E0%A6%87-%E0%A6%AC%E0%A6%BE%E0%A6%95%E0%A6%AA%E0%A7%8D%E0%A6%B0%E0%A6%A4%E0%A6%BF%E0%A6%AC%E0%A6%A8%E0%A7%8D%E0%A6%A7%E0%A7%80-%E0%A6%B6%E0%A6%BF%E0%A6%B6%E0%A7%81%E0%A6%B0-%E0%A6%9C%E0%A6%AC%E0%A6%BE%E0%A6%A8%E0%A6%AC%E0%A6%A8%E0%A7%8D%E0%A6%A6%E0%A6%BF%C2%A0,ইশারা ভাষার সহায়তায় সেই বাকপ্রতিবন্ধী শিশুর জবানবন্দি,এক সপ্তাহ পেরিয়ে গেলেও আট বছরের বাকপ্রতিবন্ধী পথশিশুর ধর্ষণকারীকে শনাক্ত করা যায়নি। তবে আদালতের নির্দেশে সমাজসেবা অধিদপ্তরের সাইন ল্যাঙ্গুয়েজ ইন্টারপ্রেটার সোমবার শিশুটির জবানবন্দি নিয়েছেন। তদন্তের স্বার্থে তা গোপন রাখা হয়েছে বলে জানান মামলার তদন্ত কর্মকর্তা এসআই সোহেল রানা।,2025-06-30
https://samakal.com/whole-country/article/303149/%E0%A6%AC%E0%A6%A8%E0%A7%8D%E0%A6%A6%E0%A6%B0-%E0%A6%95%E0%A6%BE%E0%A6%B8%E0%A7%8D%E0%A6%9F%E0%A6%AE%E0%A6%B8%E0%A7%87%E0%A6%B0-%E0%A6%95%E0%A6%BE%E0%A6%B0%E0%A7%8D%E0%A6%AF%E0%A6%95%E0%A7%8D%E0%A6%B0%E0%A6%AE-%E0%A6%B8%E0%A6%9A%E0%A6%B2-%E0%A6%B9%E0%A6%B2%E0%A7%87%E0%A6%93-%E0%A6%95%E0%A6%BE%E0%A6%9F%E0%A7%87%E0%A6%A8%E0%A6%BF-%E0%A6%AD%E0%A7%8B%E0%A6%97%E0%A6%BE%E0%A6%A8%E0%A7%8D%E0%A6%A4%E0%A6%BF,বন্দর-কাস্টমসের কার্যক্রম সচল হলেও কাটেনি ভোগান্তি,চট্টগ্রাম বন্দর ও কাস্টমস পুরোপুরি সচল হলেও দুশ্চিন্তা কাটছে না রপ্তানিকারকদের। কাস্টমস কর্মকর্তা-কর্মচারীদের ‘শাটডাউন’ কর্মসূচির কারণে দু’দিনে ১৯টি বেসরকারি ডিপোতে জমেছে ১৪ হাজার,2025-06-30
https://samakal.com/whole-country/article/303088/%E0%A6%A6%E0%A6%B2%E0%A6%BF%E0%A6%B2-%E0%A6%B2%E0%A6%BF%E0%A6%96%E0%A7%87-%E0%A6%A8%E0%A6%BE-%E0%A6%A6%E0%A7%87%E0%A6%93%E0%A7%9F%E0%A6%BE%E0%A7%9F-%E0%A6%AC%E0%A6%BE%E0%A6%AC%E0%A6%BE-%E0%A6%9B%E0%A7%87%E0%A6%B2%E0%A7%87%E0%A6%95%E0%A7%87-%E0%A6%95%E0%A7%81%E0%A6%AA%E0%A6%BF%E0%A7%9F%E0%A7%87-%E0%A6%9C%E0%A6%96%E0%A6%AE%E0%A7%87%E0%A6%B0-%E0%A6%85%E0%A6%AD%E0%A6%BF%E0%A6%AF%E0%A7%8B%E0%A6%97,দলিল লিখে না দেওয়ায় বাবা-ছেলেকে কুপিয়ে জখমের অভিযোগ,পটুয়াখালীর বাউফলের বগাবন্দর এলাকায় কবলাকৃত দলিল লিখে না দেওয়ায় হামলা চালিয়ে বাবা-ছেলেকে কুপিয়ে ও পিটিয়ে আহত করার অভিযোগ উঠেছে। ভুক্তভোগীরা হলেন- কাজী সফিকুল ইসলাম (৫৮) ও তার ছেলে জুয়েল কাজী (৩৫)।,2025-06-30
https://samakal.com/whole-country/article/303076/%E0%A6%A8%E0%A6%BF%E0%A6%B0%E0%A7%8D%E0%A6%AF%E0%A6%BE%E0%A6%A4%E0%A6%A8%E0%A7%87%E0%A6%B0-%E0%A6%86%E0%A6%B0%E0%A6%93-%E0%A6%8F%E0%A6%95%E0%A6%9F%E0%A6%BF-%E0%A6%AD%E0%A6%BF%E0%A6%A1%E0%A6%BF%E0%A6%93-%E0%A6%AD%E0%A6%BE%E0%A6%87%E0%A6%B0%E0%A6%BE%E0%A6%B2:-%E0%A6%93%E0%A6%B8%E0%A6%BF,কুমিল্লায় ধর্ষণকাণ্ড / নির্যাতনের আরও একটি ভিডিও ভাইরাল: ওসি,কুমিল্লার মুরাদনগরে এক নারীকে তার বাবার বাড়িতে নিপীড়নের আরও একটি ভিডিও সামাজিক যোগাযোগমাধ্যমে ভাইরাল হয়েছে। সোমবার সকালে ‘তোর বাপেরা আইছে’ নামের ফেসবুক আইডি থেকে ৩ মিনিট ৪২ সেকেন্ডের ওই ভিডিওটি ছড়িয়ে পড়ে। মুরাদনগার থানার ভারপ্রাপ্ত কর্মকর্তা (ওসি) জাহিদুর রহমান একথা জানিয়েছেন।,2025-06-30
https://samakal.com/whole-country/article/303087/%E0%A6%B8%E0%A7%81%E0%A6%A8%E0%A6%BE%E0%A6%AE%E0%A6%97%E0%A6%9E%E0%A7%8D%E0%A6%9C%E0%A7%87-%E0%A6%9C%E0%A7%81%E0%A6%A8-%E0%A6%AE%E0%A6%BE%E0%A6%B8%E0%A7%87-%E0%A7%A7%E0%A7%AB-%E0%A6%95%E0%A7%8B%E0%A6%9F%E0%A6%BF-%E0%A6%9F%E0%A6%BE%E0%A6%95%E0%A6%BE%E0%A6%B0-%E0%A6%AD%E0%A6%BE%E0%A6%B0%E0%A6%A4%E0%A7%80%E0%A7%9F-%E0%A6%AA%E0%A6%A3%E0%A7%8D%E0%A6%AF-%E0%A6%9C%E0%A6%AC%E0%A7%8D%E0%A6%A6,সুনামগঞ্জে জুন মাসে ১৫ কোটি টাকার ভারতীয় পণ্য জব্দ,সুনামগঞ্জ সীমান্তে অভিযান চালিয়ে জুন মাসে ১৫ কোটি টাকার ভারতীয় পণ্য জব্দ করেছে বিজিবি।,2025-06-30
https://samakal.com/whole-country/article/303062/%E0%A6%B0%E0%A7%8C%E0%A6%AE%E0%A6%BE%E0%A6%B0%E0%A7%80%E0%A6%A4%E0%A7%87-%E0%A7%A8%E0%A7%A8-%E0%A7%A7%E0%A7%A6%E0%A7%A6-%E0%A6%AA%E0%A6%BF%E0%A6%B8-%E0%A6%87%E0%A7%9F%E0%A6%BE%E0%A6%AC%E0%A6%BE%E0%A6%B8%E0%A6%B9-%E0%A6%8F%E0%A6%95%E0%A6%9C%E0%A6%A8-%E0%A6%AE%E0%A6%BE%E0%A6%A6%E0%A6%95-%E0%A6%AC%E0%A7%8D%E0%A6%AF%E0%A6%AC%E0%A6%B8%E0%A6%BE%E0%A7%9F%E0%A7%80-%E0%A6%86%E0%A6%9F%E0%A6%95,"রৌমারীতে ২২,১০০ পিস ইয়াবাসহ একজন মাদক ব্যবসায়ী আটক",সোমবার সকাল পৌনে ৮টার দিকে রৌমারী সদর ইউনিয়নের চর নতুনবন্দর এলাকা থেকে তাকে আটক করা হয়।,2025-06-30
https://samakal.com/whole-country/article/303072/%E0%A6%9A%E0%A7%81%E0%A6%B0%E0%A6%BF%E0%A6%B0-%E0%A6%85%E0%A6%AA%E0%A6%AC%E0%A6%BE%E0%A6%A6%E0%A7%87-%E0%A6%B6%E0%A7%8D%E0%A6%B0%E0%A6%AE%E0%A6%BF%E0%A6%95%E0%A6%95%E0%A7%87-%E0%A6%AC%E0%A7%87%E0%A6%81%E0%A6%A7%E0%A7%87-%E0%A6%AA%E0%A6%BF%E0%A6%9F%E0%A6%BF%E0%A7%9F%E0%A7%87-%E0%A6%B9%E0%A6%A4%E0%A7%8D%E0%A6%AF%E0%A6%BE%E0%A6%B0-%E0%A6%85%E0%A6%AD%E0%A6%BF%E0%A6%AF%E0%A7%8B%E0%A6%97-%E0%A6%AD%E0%A6%BF%E0%A6%A1%E0%A6%BF%E0%A6%93-%E0%A6%AD%E0%A6%BE%E0%A6%87%E0%A6%B0%E0%A6%BE%E0%A6%B2,"চুরির অপবাদে শ্রমিককে বেঁধে পিটিয়ে হত্যার অভিযোগ, ভিডিও ভাইরাল",চুরির অপবাদ দিয়ে কারখানার অফিসে রশি দিয়ে বেঁধে পিটিয়ে এক শ্রমিককে হত্যা করা হয়েছে। এ সংক্রান্ত একটি ভিডিও সামাজিক যোগাযোগ মাধ্যমে ভাইরাল হয়েছে। গত শনিবার থেকে কারখানাটি অনির্দিষ্টকালের জন্য বন্ধ ঘোষণা করেছে কর্তৃপক্ষ। এ ঘটনায় থানায় একটি হত্যা মামলা হলেও মারধরে জড়িত কারও নাম উল্লেখ করা হয়নি।,2025-06-30
https://samakal.com/whole-country/article/303074/%E0%A6%AD%E0%A6%BE%E0%A6%99%E0%A7%8D%E0%A6%97%E0%A6%BE-%E0%A6%8F%E0%A6%95%E0%A7%8D%E0%A6%B8%E0%A6%AA%E0%A7%8D%E0%A6%B0%E0%A7%87%E0%A6%B8%E0%A6%93%E0%A7%9F%E0%A7%87%E0%A6%A4%E0%A7%87-%E0%A6%AB%E0%A7%81%E0%A6%9F%E0%A6%AA%E0%A6%BE%E0%A6%A4-%E0%A6%A6%E0%A6%96%E0%A6%B2%E0%A6%AE%E0%A7%81%E0%A6%95%E0%A7%8D%E0%A6%A4-%E0%A6%95%E0%A6%B0%E0%A6%A4%E0%A7%87-%E0%A6%89%E0%A6%AA%E0%A6%9C%E0%A7%87%E0%A6%B2%E0%A6%BE-%E0%A6%AA%E0%A7%8D%E0%A6%B0%E0%A6%B6%E0%A6%BE%E0%A6%B8%E0%A6%A8%E0%A7%87%E0%A6%B0-%E0%A6%85%E0%A6%AD%E0%A6%BF%E0%A6%AF%E0%A6%BE%E0%A6%A8,ভাঙ্গা এক্সপ্রেসওয়েতে ফুটপাত দখলমুক্ত করতে উপজেলা প্রশাসনের অভিযান,ঢাকা-মাওয়া-ভাঙ্গা হাইওয়ে ও ফরিদপুর-ভাঙ্গা-বরিশাল মহাসড়কের গুরুত্বপূর্ণ পয়েন্ট ভাঙ্গা বাসস্ট্যান্ড ও এক্সপ্রেসওয়ের ভাঙ্গা ইন্টারচেঞ্জ এলাকায় ফুটপাত ও যাত্রীছাউনীর দখলমুক্ত করতে ভাঙ্গা উপজেলা প্রশাসন উচ্ছেদ অভিযান চালিয়েছে।,2025-06-30
https://samakal.com/whole-country/article/303070/%E0%A6%AD%E0%A7%88%E0%A6%B0%E0%A6%AC%E0%A7%87-%E0%A6%9F%E0%A6%BF%E0%A6%AB%E0%A6%BF%E0%A6%A8-%E0%A6%95%E0%A7%8D%E0%A6%AF%E0%A6%BE%E0%A6%B0%E0%A6%BF%E0%A7%9F%E0%A6%BE%E0%A6%B0-%E0%A6%A8%E0%A6%BF%E0%A7%9F%E0%A7%87-%E0%A6%A0%E0%A6%BE%E0%A6%9F%E0%A7%8D%E0%A6%9F%E0%A6%BE%E0%A6%B0-%E0%A6%9C%E0%A7%87%E0%A6%B0%E0%A7%87-%E0%A6%B8%E0%A6%82%E0%A6%98%E0%A6%B0%E0%A7%8D%E0%A6%B7-%E0%A6%86%E0%A6%B9%E0%A6%A4-%E0%A7%A7%E0%A7%A6,"ভৈরবে টিফিন ক্যারিয়ার নিয়ে ঠাট্টার জেরে সংঘর্ষ, আহত ১০",ভৈরবে টিফিন ক্যারিয়ার (ভাতের বাটি) নিয়ে ঠাট্টার জেরে দুই পক্ষের সংঘর্ষে ১০ জন আহত হয়েছেন। এসময় ভাঙচুর করা হয়েছে বেশ কয়েকটি বাড়িঘর।,2025-06-30
https://samakal.com/whole-country/article/303077/%E0%A6%A4%E0%A7%81%E0%A6%B9%E0%A6%BF%E0%A6%A8-%E0%A6%B9%E0%A6%A4%E0%A7%8D%E0%A6%AF%E0%A6%BE-%E0%A6%AE%E0%A6%BE%E0%A6%AE%E0%A6%B2%E0%A6%BE%E0%A7%9F-%E0%A6%B8%E0%A6%BE%E0%A6%AC%E0%A7%87%E0%A6%95-%E0%A6%AE%E0%A7%87%E0%A7%9F%E0%A6%B0-%E0%A6%86%E0%A6%87%E0%A6%AD%E0%A7%80%E0%A6%B0-%E0%A6%B0%E0%A6%BF%E0%A6%AE%E0%A6%BE%E0%A6%A8%E0%A7%8D%E0%A6%A1-%E0%A6%B6%E0%A7%81%E0%A6%A8%E0%A6%BE%E0%A6%A8%E0%A6%BF-%E0%A6%AA%E0%A7%87%E0%A6%9B%E0%A6%BE%E0%A6%B2,তুহিন হত্যা মামলায় সাবেক মেয়র আইভীর রিমান্ড শুনানি পেছাল,নারায়ণগঞ্জ সিটি কর্পোরেশনের সাবেক মেয়র ডা. সেলিনা হায়াৎ আইভীকে একটি হত্যা মামলায় জিজ্ঞাসাবাদের জন্য পুলিশের রিমান্ড আবেদনের শুনানির দিন পিছিয়েছেন আদালত।,2025-06-30
https://samakal.com/whole-country/article/303082/%E0%A6%AE%E0%A6%BE%E0%A6%A6%E0%A6%95-%E0%A6%AC%E0%A6%BF%E0%A6%95%E0%A7%8D%E0%A6%B0%E0%A6%BF-%E0%A6%95%E0%A6%B0%E0%A6%A4%E0%A7%87-%E0%A6%A8%E0%A6%BE-%E0%A6%95%E0%A6%B0%E0%A6%BE%E0%A7%9F-%E0%A6%B9%E0%A6%BE%E0%A6%AE%E0%A6%B2%E0%A6%BE-%E0%A6%AE%E0%A6%BE-%E0%A6%AE%E0%A7%87%E0%A7%9F%E0%A7%87-%E0%A6%97%E0%A7%81%E0%A6%B2%E0%A6%BF%E0%A6%AC%E0%A6%BF%E0%A6%A6%E0%A7%8D%E0%A6%A7,"মাদক বিক্রি করতে না করায় হামলা, মা-মেয়ে গুলিবিদ্ধ",পাবনার ঈশ্বরদীতে মাদক বিক্রি করতে না করার জেরে বাড়িতে হামলা ও মা-মেয়েকে গুলি করার অভিযোগ উঠেছে ‍দুই তরুণের বিরুদ্ধে। রোববার দিবাগত রাতে নগরীর পূর্ব নূর মহল্লা বস্তিপাড়া এলাকায় এ ঘটনা ঘটে। ঈশ্বরদী থানার ভারপ্রাপ্ত কর্মকর্তা (ওসি) আ.স.ম. আব্দুন নূর এ তথ্য নিশ্চিত করেছেন।,2025-06-30
https://samakal.com/whole-country/article/303083/%E2%80%98%E0%A6%AA%E0%A7%8D%E0%A6%B0%E0%A7%87%E0%A6%AE%E0%A6%BF%E0%A6%95%E0%A6%BE%E0%A6%B0-%E0%A6%AC%E0%A6%BF%E0%A7%9F%E0%A7%87%E0%A6%B0%E2%80%99-%E0%A6%96%E0%A6%AC%E0%A6%B0%E0%A7%87-%E0%A6%AA%E0%A7%8D%E0%A6%B0%E0%A7%87%E0%A6%AE%E0%A6%BF%E0%A6%95%E0%A7%87%E0%A6%B0-%E0%A6%86%E0%A6%A4%E0%A7%8D%E0%A6%AE%E0%A6%B9%E0%A6%A4%E0%A7%8D%E0%A6%AF%E0%A6%BE,‘প্রেমিকার বিয়ের’ খবরে প্রেমিকের আত্মহত্যা,প্রেমিকার বিয়ের খবরে কিশোর প্রেমিক গলায় ফাঁস নিয়ে ‘আত্মহত্যা’ করেছে বলে দাবি তার পরিবারের। আজ সোমবার পাবনার চাটমোহর উপজেলার কুবিরদিয়ার গ্রামে এ ঘটনা ঘটে।,2025-06-30
https://samakal.com/whole-country/article/303086/%E0%A6%95%E0%A7%8B%E0%A6%AE%E0%A6%B2-%E0%A6%AA%E0%A6%BE%E0%A6%A8%E0%A7%80%E0%A7%9F-%E0%A6%AD%E0%A7%87%E0%A6%AC%E0%A7%87-%E0%A6%95%E0%A7%80%E0%A6%9F%E0%A6%A8%E0%A6%BE%E0%A6%B6%E0%A6%95-%E0%A6%AA%E0%A6%BE%E0%A6%A8-%E0%A6%B9%E0%A6%BE%E0%A6%B8%E0%A6%AA%E0%A6%BE%E0%A6%A4%E0%A6%BE%E0%A6%B2%E0%A7%87-%E0%A6%A6%E0%A7%81%E0%A6%87-%E0%A6%AC%E0%A7%8B%E0%A6%A8,"কোমল পানীয় ভেবে কীটনাশক পান, হাসপাতালে দুই বোন",পাবনার ঈশ্বরদীতে কোমল পানীয়ের বোতলে রাখা ঘাস মারার কীটনাশক পান করে অসুস্থ হয়ে হাসপাতালে ভর্তি হয়েছে দুই চাচাতো বোন আফসানা খাতুন (৪) ও আহিয়া খাতুন (৩)। তারা বর্তমানে রাজশাহী মেডিকেল কলেজ হাসপাতালে চিকিৎসাধীন। তাদের অবস্থা আশঙ্কাজনক বলে জানিয়েছেন চিকিৎসকরা।,2025-06-30
https://samakal.com/whole-country/article/302865/%E0%A6%97%E0%A6%AD%E0%A7%80%E0%A6%B0-%E0%A6%B0%E0%A6%BE%E0%A6%A4%E0%A7%87-%E0%A6%98%E0%A6%B0-%E0%A6%A5%E0%A7%87%E0%A6%95%E0%A7%87-%E0%A6%AC%E0%A7%87%E0%A6%B0-%E0%A6%95%E0%A6%B0%E0%A7%87-%E0%A6%87%E0%A6%89%E0%A6%AA%E0%A6%BF-%E0%A6%B8%E0%A6%A6%E0%A6%B8%E0%A7%8D%E0%A6%AF%E0%A6%95%E0%A7%87-%E0%A6%95%E0%A7%81%E0%A6%AA%E0%A6%BF%E0%A7%9F%E0%A7%87-%E0%A6%B9%E0%A6%A4%E0%A7%8D%E0%A6%AF%E0%A6%BE,গভীর রাতে ঘর থেকে বের করে ইউপি সদস্যকে কুপিয়ে হত্যা,জামালপুরের ইসলামপুর উপজেলায় নিজ বাড়ির উঠানে আব্দুর রহিম নামের এক ইউপি সদস্যকে কুপিয়ে হত্যা করেছে দুর্বৃত্তরা।,2025-06-29
https://samakal.com/whole-country/article/302863/%E0%A6%87%E0%A6%9F%E0%A6%A8%E0%A6%BE%E0%A6%AF%E0%A6%BC-%E0%A6%85%E0%A6%9F%E0%A7%8B%E0%A6%B0%E0%A6%BF%E0%A6%95%E0%A6%B6%E0%A6%BE-%E0%A6%9A%E0%A6%BE%E0%A6%AA%E0%A6%BE%E0%A7%9F-%E0%A6%B6%E0%A6%BF%E0%A6%B6%E0%A7%81-%E0%A6%A8%E0%A6%BF%E0%A6%B9%E0%A6%A4,ইটনায় অটোরিকশা চাপায় শিশু নিহত,কিশোরগঞ্জের ইটনায় অটোরিকশা চাপায় আরিয়ান মিয়া (৪) নামের এক শিশু নিহত হয়েছে।,2025-06-29
https://samakal.com/whole-country/article/302838/%E0%A6%AF%E0%A7%81%E0%A6%AC%E0%A6%95%E0%A6%95%E0%A7%87-%E0%A6%B9%E0%A6%BE%E0%A6%A4-%E0%A6%AA%E0%A6%BE-%E0%A6%AC%E0%A7%87%E0%A6%81%E0%A6%A7%E0%A7%87-%E0%A6%AE%E0%A6%BE%E0%A6%B0%E0%A6%A7%E0%A6%B0-%E0%A6%AA%E0%A7%8D%E0%A6%B0%E0%A6%A4%E0%A6%BF%E0%A6%AC%E0%A6%BE%E0%A6%A6%E0%A7%87-%E0%A6%AE%E0%A6%B9%E0%A6%BE%E0%A6%B8%E0%A7%9C%E0%A6%95-%E0%A6%85%E0%A6%AC%E0%A6%B0%E0%A7%8B%E0%A6%A7,"যুবককে হাত-পা বেঁধে মারধর, প্রতিবাদে মহাসড়ক অবরোধ",গাজীপুরে গ্রিনল্যান্ড গার্মেন্টস নামে একটি পোশাক কারখানার ভেতরে চোর সন্দেহে হৃদয় মিয়া নামে এক যুবককে পেটানো হয়। সহকর্মীকে চোর সন্দেহে পেটানো হয়েছে বলে গুজব ছড়িয়ে পড়ে। পরে শনিবার দুপুরে কোনাবাড়ী এলাকায় ঢাকা-টাঙ্গাইল মহাসড়ক অবরোধ করে বিক্ষোভ করেন ওই কারখানার শ্রমিকরা।,2025-06-29
https://samakal.com/whole-country/article/302862/%E0%A6%8F%E0%A6%A8%E0%A6%AC%E0%A6%BF%E0%A6%86%E0%A6%B0-%E0%A6%B6%E0%A6%BE%E0%A6%9F%E0%A6%A1%E0%A6%BE%E0%A6%89%E0%A6%A8%E0%A7%87%E0%A6%B0-%E0%A6%AA%E0%A7%8D%E0%A6%B0%E0%A6%AD%E0%A6%BE%E0%A6%AC-%E0%A6%9A%E0%A6%9F%E0%A7%8D%E0%A6%9F%E0%A6%97%E0%A7%8D%E0%A6%B0%E0%A6%BE%E0%A6%AE-%E0%A6%AC%E0%A6%A8%E0%A7%8D%E0%A6%A6%E0%A6%B0%E0%A7%87%E0%A6%93-%E0%A6%B6%E0%A7%81%E0%A6%B2%E0%A7%8D%E0%A6%95%E0%A6%BE%E0%A7%9F%E0%A6%A8%E0%A7%87-%E0%A6%85%E0%A6%9A%E0%A6%B2%E0%A6%BE%E0%A6%AC%E0%A6%B8%E0%A7%8D%E0%A6%A5%E0%A6%BE,"এনবিআর শাটডাউনের প্রভাব চট্টগ্রাম বন্দরেও, শুল্কায়নে অচলাবস্থা",কাস্টমস কর্মকর্তা-কর্মচারীদের ‘শাটডাউন’ কর্মসূচির মুখে অচলাবস্থা তৈরি হয়েছে চট্টগ্রামে থাকা দেশের সবচেয়ে বড় শুল্ক পয়েন্টে। এটির প্রভাবে ব্যহত হচ্ছে দেশের প্রধান সমুদ্র বন্দরের কার্যক্রমও। গতকাল শনিবার ভোর ৬টা থেকে শুরু হওয়া এ কর্মসূচি আজ রোববারও চলছে। দ্বিতীয় দিনের এ কর্মসূচির কারণে বন্দর থেকে পণ্য খালাস কার্যক্রমে বাধা তৈরি হয়েছে।,2025-06-29
https://samakal.com/whole-country/article/302849/%E0%A6%B8%E0%A6%BF%E0%A6%9F%E0%A6%BF-%E0%A6%95%E0%A6%B0%E0%A6%AA%E0%A7%8B%E0%A6%B0%E0%A7%87%E0%A6%B6%E0%A6%A8-%E0%A6%B9%E0%A6%A4%E0%A7%87-%E0%A6%AA%E0%A7%8D%E0%A6%B0%E0%A6%B8%E0%A7%8D%E0%A6%A4%E0%A7%81%E0%A6%A4-%E0%A6%AC%E0%A6%97%E0%A7%81%E0%A7%9C%E0%A6%BE-%E0%A6%AF%E0%A6%BE%E0%A6%9A%E0%A7%8D%E0%A6%9B%E0%A7%87-%E0%A6%9A%E0%A6%BF%E0%A6%A0%E0%A6%BF,"সিটি করপোরেশন হতে প্রস্তুত বগুড়া, যাচ্ছে চিঠি",বগুড়া সিটি করপোরেশন প্রতিষ্ঠার লক্ষ্যে গণবিজ্ঞপ্তি জারি করা হয়েছে আগেই। এ বিষয়ে নাগরিকদের করা আবেদনের গণশুনানি কার্যক্রমও সম্প্রতি সম্পন্ন হয়েছে; যার পরিপ্রেক্ষিতে বৃহস্পতিবার বগুড়া সিটি করপোরেশনের ঘোষণা দিয়ে গেজেট প্রকাশে সংশ্লিষ্ট পর্যায়ে চিঠি দেওয়া হবে বলে জানিয়েছে জেলা প্রশাসন।,2025-06-29
https://samakal.com/whole-country/article/302848/%E0%A6%86%E0%A6%A6%E0%A6%BE%E0%A6%B2%E0%A6%A4%E0%A7%87-%E0%A6%AE%E0%A6%BE%E0%A6%AE%E0%A6%B2%E0%A6%BE-%E0%A6%AC%E0%A6%BE%E0%A6%A6%E0%A7%80%E0%A6%95%E0%A7%87-%E0%A6%A7%E0%A6%B0%E0%A7%87-%E0%A6%8F%E0%A6%A8%E0%A7%87-%E0%A6%A5%E0%A6%BE%E0%A6%A8%E0%A6%BE%E0%A7%9F-%E0%A6%86%E0%A6%AA%E0%A6%B8,"আদালতে মামলা, বাদীকে ধরে এনে থানায় আপস",দুই নারীকে শ্লীলতাহানির ঘটনায় আদালতে মামলা হয়। এক দিন পর হামলাকারী থানায় উল্টো অভিযোগ করেন। দুই নারীকে ধরে আনে কক্সবাজারের চকরিয়া থানা পুলিশ।,2025-06-29
https://samakal.com/whole-country/article/302844/%E0%A6%AE%E0%A7%81%E0%A6%B0%E0%A6%BE%E0%A6%A6%E0%A6%A8%E0%A6%97%E0%A6%B0%E0%A7%87-%E0%A6%A8%E0%A6%BE%E0%A6%B0%E0%A7%80%E0%A6%95%E0%A7%87-%E0%A6%A7%E0%A6%B0%E0%A7%8D%E0%A6%B7%E0%A6%A3-%E0%A6%93-%E0%A6%AD%E0%A6%BF%E0%A6%A1%E0%A6%BF%E0%A6%93-%E0%A6%AD%E0%A6%BE%E0%A6%87%E0%A6%B0%E0%A6%BE%E0%A6%B2%E0%A7%87%E0%A6%B0-%E0%A6%98%E0%A6%9F%E0%A6%A8%E0%A6%BE%E0%A7%9F-%E0%A6%97%E0%A7%8D%E0%A6%B0%E0%A7%87%E0%A6%AA%E0%A7%8D%E0%A6%A4%E0%A6%BE%E0%A6%B0-%E0%A7%AB,মুরাদনগরে নারীকে ধর্ষণ ও ভিডিও ভাইরালের ঘটনায় গ্রেপ্তার ৫,কুমিল্লার মুরাদনগরে এক নারীকে তার বাবার বাড়িতে ধর্ষণের ঘটনায় দায়ের করা মামলার একমাত্র আসামি ফজর আলীকে গ্রেপ্তার করেছে পুলিশ।,2025-06-29
https://samakal.com/whole-country/article/302842/%E0%A6%9C%E0%A6%BE%E0%A6%AC%E0%A6%BF%E0%A6%B0-%E0%A6%AC%E0%A6%BE%E0%A6%9C%E0%A7%87%E0%A6%9F%E0%A7%87-%E0%A6%AB%E0%A7%87%E0%A6%B0-%E0%A6%89%E0%A6%AA%E0%A7%87%E0%A6%95%E0%A7%8D%E0%A6%B7%E0%A6%BF%E0%A6%A4-%E0%A6%97%E0%A6%AC%E0%A7%87%E0%A6%B7%E0%A6%A3%E0%A6%BE-%E0%A6%93-%E0%A6%9A%E0%A6%BF%E0%A6%95%E0%A6%BF%E0%A7%8E%E0%A6%B8%E0%A6%BE-%E0%A6%96%E0%A6%BE%E0%A6%A4,জাবির বাজেটে ফের উপেক্ষিত গবেষণা ও চিকিৎসা খাত,জাহাঙ্গীরনগর বিশ্ববিদ্যালয়ে (জাবি) ২০২৫—২৬ অর্থবছরের জন্য ৩২৩ কোটি ৩৪ লাখ টাকার বাজেট ঘোষণা করা হয়েছে। গত বছরের তুলনায় এ বাজেটে ৪ কোটি ৯১ লাখ টাকা বাড়লেও ফের উপেক্ষিত হয়েছে গবেষণা ও চিকিৎসা খাত।,2025-06-29
